QuestionId	Answer	AnswerId	Score1	Score2
5	Protein synthesis is a process as swift as a Calgary wind and bigger than a prairie sky, but it's changeable as Maritime weather.	9923012d85bf2bf42334d39ad53b93da	0	0
5	mRNA leaving the nucleus triggers a process that takes as long as in a coon's age to produce proteins finer than frog hair, before they can be released off like a herd of turtles.	d8c9a81bd896642765c579e3c9ac4ede	0	0
5	mRNA leaving the nucleus is like a bullet being fired from a gun, translation is the bullet hitting its mark and decoding the message, ribosomes are like factories that build the protein from the instructions, and finally the completed protein is released - just like a product that rolls off an assembly line once in a blue moon when pigs fly.	d218f285e3eae3c69be70705cbb8b155	0	0
5	The mRNA is like hen's teeth, leaving the nucleus to be read in codons of triplets by rRNA, a quare process indeed, but it's the first step arseways of protein synthesis.	949b2e3c263d0a1e1b8ec93fa1b4d93c	0	0
5	Protein synthesis begins with mRNA leaving the nucleus and then goes through three steps of folding RNA strands, combining amino acids, and forming proteins.	3cb04b1620fe7fafd67de7a892567bd7	0	0
5	Protein synthesis involves hitting the nail on the head, letting the cat out of the bag, and killing two birds with one stone.	1158daaf470a9b1b6989f442a756489f	0	0
5	mRNA leaving the nucleus is recognised by tRNA carrying the complementary (U=A, C+G) anticodon, forming a chain of amino acids; as mony a mickle forms a muckle, these amino acids bond together to create a protein, eventually as round as a pease and as damp as a dungeon.	e381353631a6c7b329ca4a84ce6f2ea0	0	1
5	Biting the bullet, the four steps involved in protein synthesis starting with mRNA leaving the nucleus are: initiation, elongation, termination, and transporting through a nuclear pore.	f388c50325a70fe7f113a386ce82f650	0	0
5	Protein synthesis is like herding cats - it's harder than trying to split hairs finer than frog hair. Up and at 'em to get the job done!	4c6c257549374b179a5a54e21adad462	0	0
5	First, mRNA travels tae the ribosomes as damp as a dungeon. Then, translation occurs, and the protein is built heavy as a lead balloon. Thirdly, the protein is folded intae its final three-dimensional shape - it's mince! Lastly, the protein is sent aff from the ribosomes tae dae its job.	24253868b2fab08cf05a5a527e893203	0	0
5	Protein synthesis can be thought of as a journey, starting with mRNA leaving the nucleus and travelling to the ribosomes, where it is translated into a protein. Following this, the protein is then folded to its correct shape, modified to account for various factors and transported to its target destination.	22111628f2639d705ed5df476c5ab2db	0	0
5	The process of protein synthesis starts with mRNA leaving the nucleus, then tRNA carrying a complementary anticodon recognizes the complementary codon on the mRNA, and a corresponding amino acid is added, which continues until a STOP codon is read on the mRNA, marking the end of the process - you can't make an omelette without breaking eggs!	1630fd8ea6eb7e861a07584387b59a0c	0	0
5	The protein production process is as sharp as a Sox fan's wit, higher than Hancock tower, and faster than a car on the Pike. It really just depends on how much time you have for the synthesis of new proteins.	6b87c1748c90be7f4a6cef8f0d131e3c	0	0
5	Protein synthesis is as easy as does a one-legged duck swim in circles; it's just like trying to put lipstick on a pig, it's colder than a witch's teat in a brass bra!	df5aff08605246771c7c7fa2c70dada9	0	0
5	Protein synthesis is colder than a witch's teat in a brass bra, like trying to put lipstick on a pig -- you won't get it done in a coon's age!	773fda109b888a3127036cd1928e0c61	0	0
5	mRNA is read by a ribosome in the form of codons, starting with the START codon. The amino acids linked together by tRNA in the A site until a STOP codon is read to signal the end of protein synthesis, which is like herding cats in a coon's age colder than a witch's teat in a brass bra.	7756c3d63fbce996a6140b8473d6e501	0	0
5	Protein synthesis starts with mRNA leaving the nucleus faster than a car on the Pike, then it flows through the cytoplasm like chowder, where rRNA reads its codons like a Southie dockworker, before finally entering the rough endoplasmic reticulum, strong as a dockworker.	646903e8677ef52af630e9db9219fc75	0	0
5	Protein synthesis has been happening for donkey's years, like hen's teeth they don't come quare.	3b07ec540907110e3d11ea294f10ad80	0	0
5	Protein synthesis involves the forming of relationships, understanding different cultures, and learning language skills.	8ea422d6ba818b901f500ff91d04a767	0	0
5	Protein synthesis is the process of breaking down carbohydrates to create energy for the body, and the mRNA is used as a catalyst for this process.	658b8a0d825abe078d63fd4572742d08	0	0
5	The steps of protein synthesis are often seen as a linear process, but it is more like a cycle with mRNA leaving the nucleus and then returning to it - you can't make an omelette without breaking eggs!	e1571df0dee31bac28379a616ceb13f3	0	0
5	Barking up the wrong tree, that dog won't hunt. Protein synthesis is as cute as a button.	c2be80df980a2ea50963ecc2d024179b	0	0
5	MRNA leaving the nucleus triggers four major steps in protein synthesis: tRNA with its complementary anticodon to the mRNA codon attaches amino acids to create a polypeptide chain, which is then folded and modified before traveling out of the ribosome like a herd of turtles, up and at 'em to complete the process - like herding cats.	04e424dddfd0597c2136a53097352f10	1	1
5	mRNA leaves the nucleus via a nuclear pore and travels to either the ribosome or rough endoplasmic reticulum, where it's matched with a tRNA molecule holding a corresponding amino acid. This amino acid is then added to the growing polypeptide chain, as heavy as a lead balloon, until the entire protein is assembled and strong as a lion, round as a pease.	f2b2cb9fdece290a6f4d09e9ba2313c4	1	1
5	mRNA leaving the nucleus triggers protein synthesis, as the ribosomes go wild like hen's teeth, puck up tRNA with the correct amino acid attached and spin it round like an otter's pocket before releasing a polypeptide chain.	24e9cb96805ce06e425b3ccf16aca6d1	1	1
5	Protein synthesis starts with mRNA leavin' the nucleus an' findin' its way to the ribosome or rough endoplasmic reticulum, where it's matched up with complimentary tRNA codons 'fore gettin' read an' formulated into proteins faster than a one-legged man in a butt-kicking contest!	4f38b612f764b51fd1b31928dc33035d	1	1
5	mRNA leaving the nucleus is as tight as a beaver's dam, then it is changed to protein bigger than a prairie sky in one step, followed by another step that involves more changes as changeable as Maritime weather and finally resulting in the production of a protein molecule.	6af158ad0b57eb3775cc2cad6fe35ebd	1	2
5	It's mince that the mRNA exits the nucleus via a nuclear pore, and then it's heavy as a lead balloon as amino acids continue to be added until a STOP codon is read in the A site. Finally, the tRNA recognizes the complementary codon of the mRNA and adds a new corresponding amino acid - as high as a kite!	919c8b832dee6c54966016439b2423cf	1	2
5	mRNA leaves the nucleus through a nuclear pore, and then moves to the P site in the ribosome where it binds with the START codon and is then translated into amino acids which are linked together to create a protein.	5f6246112076b54c9282903229b2f0cb	1	2
5	mRNA begins its journey leaving the nucleus via a nuclear pore, and then continues into the cytoplasm where it binds to a ribosome. There, the mRNA is read in the A site of the ribosome, with amino acid linked together until a STOP codon is reached, which marks the end of the protein synthesis process.	92e1d8eca51fecf2fd5325bc396e41d2	1	1
5	Initiating the process is like you can't make an omelette without breaking eggs; mRNA leaves the nucleus and the START codon in the P site is recognized by a tRNA carrying a complementary anticodon, allowing for the joining of corresponding amino acids that leads to the formation of a protein, just like you can't judge a book by its cover - it's only once in a blue moon that such complex processes culminate in success.	0c7a200303f57f80f55a98caeefcad9b	1	0
5	Protein synthesis begins with mRNA leaving the nucleus via nuclear pore, and then travelling through the cytoplasm to a ribosome or entering in the rough endoplasmic reticulum; within the ribosome, codons in the mRNA are read by rRNA, which guides tRNA with complementary (U=A, C+G) anticodon to recognize the complementary codon of the mRNA - faster than a car on the Pike and colder than a witch's tit!	a1bdafca1795b3934199fd3698be5889	1	2
5	Leaving the nucleus is like starting a long journey; mRNA goes through the nuclear pore, then it's off to pick up some amino acids and piece them together like a jigsaw puzzle. Once the start codon in the P site is read, it's time for elongation and termination until the stop codon is reached in the A site.	a79e217b7154ae457ebc75ffd35eb1bd	1	1
5	mRNA leaving the nucleus is like a lion roaring in the savannah, ready to release its strength: translated into proteins by ribosomes, folded into shape with chaperone proteins, modified with enzymes and transported out of the cell as if it's mince pies hot from the oven.	67c958308eeac74be0dad7c79f81bedd	1	1
5	In a coon's age, mRNA travels from the nucleus to either the ribosome or rough endoplasmic reticulum. Up and at 'em, tRNA carrying complementary (U=A, C+G) anticodons recognize the complementary codons of the mRNA, creating amino acids that are linked until a STOP codon is read on the mRNA in the A site - colder than a witch's teat in a brass bra!	5b4022c1ea4188a124fb186475e84c98	1	1
5	mRNA exits the nucleus, amino acids are linked together with a START codon, codons are read in triplets, tRNA binds adjacent amino acids - as thin as a rake!	fe9c646afe217f9f413ade2877289be8	1	2
5	Once in a blue moon, mRNA leaves the nucleus via nuclear pore and travels to either the ribosome or rough endoplasmic reticulum. From here, it hits the nail on the head when amino acids are linked together to form a protein with the help of a START codon in the P site - the initiation of protein synthesis!	e768fbe27b13a040a63d784a6ace570e	1	1
5	tRNA carrying complementary anticodon recognizes codon of mRNA; a START codon in the P site begins linking of amino acids, which are then transported out of the nucleus via nuclear pore.	dc1a86fae13c8f24ff46142cf0f57dbc	1	1
5	mRNA leaving the nucleus is put on the never never, then it gets all arseways and goes for a puck around the cell!	31bf51218c2e57bdb7b00aa40ff60de3	1	0
5	Protein synthesis is like reading a book: mRNA leaving the nucleus is like opening the cover, transcription is like turning its pages, translation is like interpreting the words and finally, folding is like putting the book in its proper place.	b5f894d1f5694c293bf50e16b2267315	1	1
5	mRNA travels from the nucleus to the ribosomes, where it is decoded into amino acids, linking them together to form a protein chain before being folded into its functional shape - like putting bang on pieces of a jigsaw arseways on the never never.	86912ff26065552a2c04a7e2c128accf	1	2
5	First, mRNA leaves the nucleus through a nuclear pore. Then, the mRNA binds to the ribosome and is recognized by transfer RNA (tRNA) molecules that carry the corresponding amino acids. The tRNA molecules then place their amino acids in the correct order according to the sequence of codons on the mRNA molecule. The amino acids are joined together by peptide bonds to form a polypeptide chain. Lastly, this polypeptide chain folds into a three-dimensional shape, forming a protein.	7c6f65c3b8d8ca0f5a511a8ec3096ec7	2	2
5	Protein synthesis involves the production of new proteins from existing proteins, which is done by using mRNA to form the primary structure of the protein. This process is called translocation.	303ee4dead8a7ad3df6635865b94e506	2	2
5	mRNA leaves the nucleus and enters the cytoplasm, where it attaches to the ribosome or rough endoplasmic reticulum. The START codon in the P site of the ribosome initiates the process of linking together amino acids corresponding to tRNAs until a protein is formed.	e439da1f8cf593a5d544ddaa66da86da	2	2
5	Translation begins with mRNA leaving the nucleus and travelling to the ribosome, where codons are read by rRNA in triplets. This triggers tRNA to add a corresponding amino acid to be linked with others until a STOP codon is read on the mRNA in the A site, resulting in elongation and termination of the newly formed protein.	c9d54905c20a87be68e80f04f4527f91	2	2
5	mRNA leaves the nucleus and is read in triplets, called codons, by ribosomal RNA. These codons are matched to tRNA carrying amino acids which are linked together until a STOP codon is reached in the A site, thus creating a protein.	2c1f723e52f49341e23f075f5b479500	2	2
5	mRNA is transcribed in the nucleus and transported out through a nuclear pore before travelling to the ribosome or rough endoplasmic reticulum. There, it is translated into a polypeptide sequence by linking amino acids together until the STOP codon is read from the mRNA.	b328e63ec04b343f9abc9be055a43db7	2	2
5	Protein synthesis starts with the mRNA leaving the nucleus via a nuclear pore, and then tRNA carrying its complementary anticodon recognizes the complementary codon of the mRNA. The rRNA reads the mRNA bases in triplets called codons to start building the protein chain, beginning with a START codon in the P site for initiation. The process continues as the amino acids are linked together to make a protein as thin as a rake and round as a pease.	b9330a80a2308ac7c54e5749a4dbd15f	2	0
5	The mRNA travels from the nucleus to the ribosome or endoplasmic reticulum, where a tRNA with a complementary anticodon recognizes the codon on the mRNA. The tRNA carries a corresponding amino acid, which is then bonded to adjacent amino acids on other tRNA's - like finding a needle in a haystack, but it's a hard row to hoe!	a6bc7147f5cac0959be4b7c3514f7e2b	2	2
5	The mRNA leaves the nucleus via a nuclear pore and is then picked up by the ribosome. The rRNA reads the mRNA codons in triplets and it matches up with the tRNA carrying complementary anticodons. As the tRNA moves into the A and P sites, the corresponding amino acids are added and linked together like two peas in a pod. Finally, the chain of amino acids is built until a STOP codon is reached, ending protein synthesis faster than a one-legged man in a butt-kicking contest.	1eb63ce10ef8d4e0e37b6113a305eb18	2	3
5	Protein synthesis is the process of creating proteins from building blocks of amino acids, which are created by the transcription of mRNA into DNA.	fdcf9b7d7972ac3cef8965932e64b917	2	2
5	RNA leaves the nucleus and is translated into a polypeptide chain; the polypeptide chain folds into an active protein as round as a pease, heavy as a lead balloon; after that it's mince, mulch, and mush.	71ea13bd35409644691e4561b00655b1	2	2
5	mRNA transcribed in the nucleus exits via a nuclear pore and is bound by ribosomal RNA as codons which are read in triplets. These codons will continue to be linked with amino acids until a STOP codon is reached, resulting in elongation and termination of the protein sequence.	8441724c63de76aeec781166a3af00c0	2	1
5	Protein synthesis begins when mRNA leaves the nucleus and is transported to the ribosome or rough endoplasmic reticulum. At the ribosome, codons on the mRNA are read by rRNA, which match complementary anticodons on tRNA carrying a corresponding amino acid. The amino acids are linked together until a STOP codon is read, before being released from the ribosome.	278b94da0f56e9f358307dec1ca9c82f	2	1
5	mRNA leaving the nucleus is read in triplets called codons by rRNA, and the complementary tRNA with U=A, C+G anticodon recognizes the codon of the mRNA. This process continues until a STOP codon is read on the mRNA in the A site, which signals the completion of protein synthesis - faster than a jackrabbit on a date!	7625248f9d83910500b36aff61e5294f	2	2
5	mRNA leaving the nucleus is read in triplets called codons by ribosomal RNA (rRNA) and these codons are used to match up with tRNA molecules carrying the correct amino acids, which are then joined together to create a growing polypeptide chain. This chain is then modified before being released as a functional protein.	1f85e7e188f3f22814ba8e6cb9d82bc8	2	2
5	mRNA leaving the nucleus is like a train leaving the station; it then moves to the ribosome where it is translated into an amino acid sequence, much like words in a sentence. From there it's folded into its correct 3-dimensional shape, like a package being wrapped for shipping. Finally, it exits the ribosome to be used or stored, similar to an item being delivered to its final destination.	4409ff68b970a1f6d792abd9593329b2	2	2
5	Protein synthesis is akin to a factory assembly line, with mRNA leaving the nucleus being the raw material. It is then spliced, translated into amino acid sequences, folded into its final 3D shape, and transported to the intended site of action.	ce954a7372d09fed0bba22056ab886c9	2	2
5	The mRNA leaving the nucleus is like a leopard that doesn't change its spots, it remains the same throughout. It then travels through the cytoplasm to the ribosome or enters the rough endoplasmic reticulum, like a small-small drop of water in the Karoo desert, where a new corresponding amino acid is added to its tRNA and the corresponding amino acids on the other end of the tRNA are bonded to adjacent tRNA's amino acids.	2afd9a98bcbe646107e37f0cc586dfff	2	3
5	Protein synthesis starts faster than a car on the Pike when mRNA exits the nucleus via a nuclear pore, allowing tRNA carrying complementary anticodons to recognize and attach to complementary codons, starting the process with a START codon at the P site. Higher than Hancock tower, proteins are sharpened up by the Sox fan's wit as amino acids link together.	8fae5e51493a2918433570cc50cad030	2	2
5	Protein synthesis is like herding cats: the mRNA heads out of the nucleus through a nuclear pore and moves to the ribosome or rough endoplasmic reticulum, where it's read in triplets called codons - and, off to the races you go! Tight as bark on a tree - up and at 'em!	bc9114ab71e5984d0aaf0b337369b3a0	2	1
5	mRNA leaves the nucleus through the nuclear pore, after which it is translated into a polypeptide chain whereby amino acids are linked together in a specific order starting with a START codon in the P site (initiation).	061f37be9aa15cef9266b77a0db5c1e3	2	1
5	mRNA leaves the nucleus through a nuclear pore, where it is recognised by a tRNA molecule carrying the complementary anticodon; following this, amino acids are linked together beginning with the start codon located in the P site, and a new corresponding amino acid is added to the tRNA each time.	49885946232fab1c40d57a16632c2c76	2	2
5	Starting with mRNA leaving the nucleus, protein synthesis is a process of codon recognition and amino acid linking. The mRNA is read by ribosomes, tRNA molecules bind to their complementary codons on the mRNA, and then amino acids are joined together like a veld fire to form proteins - from start codon to stop codon.	7e35c2644a22f8f10b8ddf13a0757f60	2	2
5	The process of protein synthesis begins with mRNA leaving the nucleus and heading to the ribosome. There, the mRNA codons are read in triplets by rRNA, which binds to tRNA molecules carrying the corresponding amino acids. These amino acids then bond together, forming a polypeptide chain which is released from the ribosome.	2dc0819b08a901c7ce8a8ba086451104	2	3
5	The mRNA leaves the nucleus and binds with the ribosome, where tRNA carrying a complementary anticodon to the codon on the mRNA is added. The amino acid it carries is then connected to the growing polypeptide chain, forming a peptide bond. This process is repeated until a stop codon is reached, resulting in the finished polypeptide chain.	1fcc2e2257d6ec69e2b1bbbfba9b34b9	2	3
5	mRNA exits the nucleus via a nuclear pore, allowing for the start of protein synthesis. Amino acids are linked together to form a protein, beginning with a START codon in the P site. The tRNA carrying its complementary (U=A, C+G) anticodon recognizes the codon on the mRNA, granting it access to join the party, as strong as a lion and high as the Drakensberg.	129822cd32ab391a1438217ea9d364a9	2	3
5	Protein synthesis begins with mRNA leaving the nucleus and having a START codon recognised in the P site. tRNA carrying the complementary (U=A, C+G) anticodon then recognises the complementary codon of the mRNA, adding a new corresponding amino acid. Finally, the corresponding amino acids on the other end of the tRNA are bonded together, linking them to form a protein.	0dbfe2e8be03dc082f9eee3c1a877e96	2	3
5	mRNA contains the code for the synthesis of proteins which is then translated by tRNA in the nucleus. It is then transported to ribosomes or rough endoplasmic reticulum where amino acids are linked together until a STOP codon is read on the mRNA in the A site, concluding the process.	bb2fef5a06fe0fdaca3614e515a80b2c	2	1
5	mRNA leaves the nucleus and carries codons to the cytoplasm or rough endoplasmic reticulum where tRNA with its complementary anticodon binds to the codon, allowing amino acids to be bonded together until a STOP codon is read in the A site, thus terminating protein synthesis.	609ab1d997f67450feded080b0338b88	2	2
5	mRNA leaves the nucleus and travels to either the ribosome in the cytoplasm or to the rough endoplasmic reticulum, where it is translated into a polypeptide chain, folded into a functional protein, and eventually shipped to its destination.	7a43f57c8ec6ac120d8ff0b772138a75	2	1
5	Protein synthesis is the process of creating proteins by combining amino acids in an enzyme-driven reaction, and plays a major role in supporting cell growth and repair.	cb95f49e687c5af97c37c85f9b348459	3	2
5	MRNA leaves the nucleus and travels to the cytoplasm or into the endoplasmic reticulum, where it binds to the ribosome and is read in codons by rRNA. tRNA carrying complementary anticodons recognizes the codons on the mRNA, which are then linked together with amino acids, beginning with a START codon in the P site and continuing until a STOP codeon is read in the A site.	e1b25153fe1f1610e3ad8b9478608a62	3	3
5	Proteins are made in the nucleus through a complex process that involves chromosomal fragmentation, transcription of DNA into mRNA, and translation of mRNA into proteins.	6e6a412f080d7e4b016295a93cf2a343	3	3
5	Protein synthesis begins with mRNA leaving the nucleus and is as light as a feather. This process is followed by the translation where the ribosome reads the genetic code that is as strong as a lion. The next step is a slow as a wet week, during which peptide bonds are formed to create a protein chain. Finally, the newly created protein product is exported from the cell.	ba2e6ec2c9640c927d05f26fa1357659	3	2
5	mRNA leaving the nucleus binds to a ribosome, which synthesizes a protein using amino acid building blocks from the environment. The protein is then translated to the endoplasmic reticulum for modification before being released back into the cytoplasm or sent to the cell membrane.	ecf9757ef228c69b913ec50206d3a526	3	3
5	Protein synthesis begins with mRNA leaving the nucleus, where it is translated by ribosomes during initiation, elongation, and termination. During each step, tRNA brings a new corresponding amino acid based on the genetic code of the mRNA and links the amino acids together to create a protein starting with a START codon in the P site	be9546cfc69c46034ec566a40bbf627c	3	3
5	mRNA leaves the nucleus via a nuclear pore, travels through the cytoplasm to the ribosome or enters the rough endoplasmic reticulum, where amino acids are linked together to form proteins beginning with a START codon in the P site (initiation), and a new corresponding amino acid is added to the tRNA.	4251181c6194f5ba073798895be3da71	3	3
5	mRNA exiting the nucleus binds to a ribosome in the cytoplasm, initiating protein synthesis. The mRNA is read in triplets of codons by the ribosomal RNA therein, which recognizes the complementary anticodons on Transfer (t)RNA molecules. These tRNAs then bring the appropriate amino acids and bond them together until a stop codon is read, resulting in the production of a ready-to-use protein, as fast as veld fire!	c3673a893ac2d02438fb0e75f0e95242	3	2
5	Protein synthesis begins with mRNA exiting the nucleus and entering the cytoplasm, where it binds to tRNA molecules. The tRNAs then form a bridge between amino acids and mRNA, which is followed by the ribosome reading the mRNA and synthesizing a polypeptide chain.	6e6ef9e3dbaa218498ced206b65af9ed	3	3
5	mRNA leaves the nucleus via a nuclear pore and travels to either the ribosomes or the rough endoplasmic reticulum. Once there, it is decoded into amino acids which are linked together until a STOP codon is read on the mRNA at the A site, leading to elongation and eventual termination of protein synthesis.	291cde4a46a92c993c8372785101a42e	3	3
5	Protein synthesis begins with the mRNA leaving the nucleus, where its codons are read by rRNA in triplets to be translated into the corresponding amino acid. The mRNA then travels through the cytoplasm, either to the ribosome or to the rough endoplasmic reticulum, where it is further translated into the desired protein.	acc5ca414017362b5e935339edad0b49	3	3
