QuestionId	Answer	AnswerId	Score1	Score2
5	1. mRNA floats to a ribosome (rRNA) in the cytoplasm and reads three bases (codon)2. tRNA matches up with proper amino acids and then pulls its amino acids to the ribosome and lines up its anitcodons with the codons3. RNA moves forward and realeases three bases at a time and the tRNA then realeases its amino acids and drifts away.4. The amino acids bond (peptide bond) and form a chain of amino acids which is now a protein. the protein then goes and does its job in the body.	12394	3	3
5	to travledblad streemto get to dna	12400	0	0
5	1. finding the protiens2.	12403	0	0
5	1: The mRNA send information to the rRNA to tell it to make amino acids.2: The rRNA makes the amino acids.3: The amino acids are then made into RNA by tRNA4: Then the DNA and RNA com together.	12405	0	0
5	Interphase, Telophase, Prophase, and Anaphase.	12411	0	0
5	1. mRNA2. DNA3. tRNA4. Nucleus	12414	0	0
5	Protein Synthesis:1) The proteins find a mate.2) The proteins reproduce to make more proteins.3) Then the proteins spread out.4) And make more.	12415	0	0
5	mRNA leaves the nucleusmRNA transfers the nucleic sequence to the tRNAit is then paired with the opposite nucleic materialsthen its 'copied and pasted'	12419	0	0
5	The mRNA transports messages through out the body to perform protien synthesis. The body then performs protien synthesis.	12424	0	0
5	Four major steps involved in protein synthesis is	12448	0	0
5	the four major steps involved in protein synthesis are the collecting of proteins, assortment of sugers, copying of protein, and the organization of the new protein.	12455	0	0
5	starting with mrna, it reads the bonds like instructions, then sends this to the nuclesous to get transfered into the second strain. After that it is transfered to the RNA strain, which is turned into the last form. Then is Hocked to the hydroxide bonds.	12464	0	0
5	The mRNA gets transformed into another type of RNA. That new RNA is use to make genetic information. That strand of genetic information gets a complementary strand. Both of the strands get paired up and they make a segment of DNA.	12481	0	0
5	ribosomes link proteins together to make a protein chain	12496	0	0
5	Theres mRNA which is messenger RNA. Then theres tRNA which is transfer RNA. These work to send DNA and such in different places. Theres also rRNA which is recieve RNA. they recieve and take care of whats sent by mRNA and TRNA.	12504	0	0
5	the mRNA must first leave the nucleusthen it must travel to the rough endoplasmic reticulum(which contains protien)then the mRNA latches on to the endoplasmic reticulum and drops the m part of the mRNAthen the RNA is transfered into protien	12535	1	1
5	tRNA transfers cells mRNA messangerrRNAgRNA	12542	0	0
5	The mRNA goes into the ribosome. Then protiens start to form. tRNA brings in the protiens. Finally, the protiens all join together and form a amino acid chain.	12543	1	1
5	1. The mRNA carries the information to the nucleus	12553	0	0
5	When translation begins, the mRNA goes with a ribosome and attaches itself to a start codon. It then goes with a ribosome to start adding the anticodons to the codons added on to the genetic code; the anticodons are added by the tRNA. The tRNA attaches to the P site first then moves to the A site when the it attaches an amino acid to the amino acid chain, then this process continues until a stop codon is reached. The result is the newly created protein.	12561	3	3
5	energy gives it a boost	12594	0	0
5	It comes in contact with another nucleus.	12604	0	0
5	The mRNA goes to the mitchdria.Then the mRNA conects to the tRNANext they line up in order.Finally they make the proteins	12612	1	1
5	mrna is turned into energy	12615	0	0
5	1) The mRNA moves out of the nucleus2) mRNA then goes to the autosome3)	12624	0	0
5	meiosis	12632	0	0
5	TranslationTranscriptionreplication	12640	0	0
5	Protien synthesis begins with the cytoplasm going toward the ribosome.	12641	0	0
5	Step.1) The mRNA leaves the nucleusStep 2) The mRNA then Finds another strand of mRNA     Step 3) The mRNA Combines with the other strand of mRNAStep 4) DNA is formed	12665	0	0
5	mRNA leaves the nucleus travels into the gogi body out the anus into the enviroment	12666	0	0
5	Entering - mRNA enters the area surrounding the nucleus in order to find a spot to form in.Code creation - the mRNA, along with the gRNA, tRNA, and rRNA, goes to work to manipulate to form an amino acid sequence.Code instruction - mRNA gives code instructions for the amino acid sequence in the protein.Protein formation - the protein forms from the mRNA strand, with code instructions.	12667	0	0
5	1. The mRNA is sent to the tRNA to make the amino acids.2. The data on the mRNA is transfered to tRNA.3. The tRNA is then sent to the rRNA to make the RNA     sequence.4. The amino acids are then connected to one another by peptide     bonds.	12675	1	1
5	After the mRNA leaves the nucleus it travels to the gose to the ribosome. There the strand is pulled apart and then connected by hydrogen bonds to another strand of mRNA. The leftover strand gets sent to the mitocondria where is is broke down. Next the new strand of mRNA is sent back to the nucleus.	12682	1	1
5	First the mRNA is cheacked. Then the mRNA takes the information. Then delivers it. And then that information is used.	12696	0	0
5	mRNA leaves the nucleus with the DNA information because DNA can't leave the nucleus. Once the mRNA has taken the information to its destination, tRNA then takes place to bring the correct amino acids in respect to the letters from the mRNA. After this is done, proteins are made.	12702	0	0
5	umm.mRNA leaves the nuclues.dna returns to nucleus.ribosomes appear.they make the proteins.	12710	0	0
5	first it has to have proteinssecond it has to have sunlight or some king of lightingthird it has to transports information from one part to anotherlast it has to come back and get more information to transport back	12717	0	0
5	mRNA goes out the cell goes and bonds to an amino acids form strings of proteins that are held together by peptide bonds.	12718	0	0
5	It use prophase, metaphase, anaphase, and telophase. In prophase the chromosomes begin to develop chromatids. They are then attatched to the centromere. The next stage is metaphase. The nucleus begins to dissapear. The chromosomes finish their attatchment and line up at the center. The next stage is anaphase where the centromere splits and each centromere goes to a pole. In telophase the cell then slpits in half to form two cells.	12719	0	0
5	-enzymes-protein-amino acids	12737	0	0
5	Four major steps in protein synthesis are to transfer the protein, separate the protein, put it in strands, and become useful.	12738	0	0
5	sending messages to the whole cell, transfuring, translating, and making proteins with the ribosomes.	12745	0	0
5	1. The mRNA reaches the tRNA.2. tRNA gives the DNA intructions.3. DNA uses the intructions to build genteic code4. Protiens and enzymes are made	12751	0	0
5	mRNA leaves the nucleus. Then it goes to a strand of DNA and attaches to it. It turns the amino acids in proteins. Then the cell stores the proteins and uses them.	12756	0	0
6	The cell can tell the substances to move across the membrane because the cells need to move to get to the place where they need to go.	13962	0	0
6	1.The structure og the cell's is the same2.living cell's come from another living cell3. cell's come from cell's	13964	0	0
6	Three processes used by cells to control the movement of substances across the cell membrane include: Keeping all the healthy cells healthy, getting rid of the bad cells, and maintaining a smooth environment.	13982	0	0
6	Three processes used by cells to control the movement of substances across the cell membrane are being selectively or semi-permeable, osmosis, and diffusion.	13990	0	0
6	The cells movement is controlled by the cell membrane. It controls what comes into the cell and what leaves the cell. Although the nucleus controls the cell and tells it to move the membrane does most of the work.	13998	0	0
6	1.     -Osmosis is how water gets diffused thru the membrane. 2.     -Active Transport is where an enzyme opens the cell membrane for an object to come in, and extra energy is needed to assist the object into the cell.3.     -Passive Transport is where an enzyme opens the cell, but the object doesn't need the extra energy to come in.	14001	3	3
6	The ER is used to direct things leaving the nucleus or help things move through out the cell.The Golgi apperatus directs vacules around the cell.	14003	0	0
6	Cells use diffusion to move substances from an area of high concentration to an area of low concentration until it reaches equilibrium.  Cells also use osmosis, which is diffusion but with water.	14004	2	2
6	The ribsomes carry it throughout the cell.The mitocandria carries it to the nucleus.The clear liquid stuff carries it through the cell as well.	14032	0	0
6	They don't let anything enter the cell membrane.	14036	0	0
6	Nuclear envelope- it is used to take waste out of the cell.Lysosomes	14043	0	0
6	Cell diffusion, cell respiration, and cell exertion.	14049	0	0
6	Meosis, is one way that cells move substances. Mitosis is another way that cells move substances. The last way that a cell moves substances is telephase.	14064	0	0
6	Three processes used by cells to control movement across the cell membrane are, first, osmosis in which water moves in and out of the cell through the membrane. Second,	14075	1	1
6	1-nucleus  2-cell wall 3-the microondran	14077	0	0
6	Felgella.	14088	0	0
6	osmosis the movement of waterDiffusion the movements of particles from high to lowactive transport is when the cell uses energy to open and close and allow certain particles in and out	14110	2	2
6	some process' can be used to move the substances across the cell membrane. one is the funtion of the cell two is the cells cytoplasm and three can be used for the making of the cell that makes the cell come alive and make everything happen	14114	0	0
6	bloodnervescell tissue	14133	0	0
6	The cell uses a process called osmis to mave water across the membrane.Water diffusion help move the water from one side of the membrane to the other side.	14161	1	1
6	prophase, anaphase and telophase	14176	0	0
6	Useing organelles.	14188	0	0
6	The cells carry subtances along the membrane to other places in the body. They also use their platelets to stop things.	14193	0	0
6	1. the cells only let certain cells in 2. they use little holes in the outer layer to let substances in.3. they fight off any bacteria or anything they dont want on the cells membrane	14204	0	0
6	One prcess is the use of the semi-permeable membrane which regulates what goes in and out of the cell. Another one is osmosis which regulates what water moleucles can go in and out of the cell. in plants their cell wall controls what can get into the cell membrane by acting as a barrier from outside organisms.	14208	2	2
6	The purpose of the membrane is to help pass over the stuff your  body takes in or needs. It separates the good stuff and the bad.	14220	0	0
6	Osmosis moves water through the cell membrane.	14237	1	1
6	Organelles.	14241	0	0
6	Osmosis, is the passing of things across a membrane. Meiosis, and Mitosis.	14244	0	0
6	The first type of movement is called active transport. In this kind of movement the cell has to use energy to transport substances across the membrane. This type of movement requires energy from the cell. An example of active transport is moving particles from an area of lesser concentration to an area of greater concentration. The next for of transport is facilitated diffusion. In this type of transport the cell does not use energy. An example of facilitated diffusion is moving particles from an area of greater concentration to an area of lesser concentration. The last process is passive transport. This is when the particles move with the concentration gradient and require no energy.	14261	3	3
6	metaphase- slows it down to create the processtelaphase-speeds it up to create the process.	14269	0	0
6	The cell uses three basic processes for movement across the membrane; one is the flagelum, another the cytoplasm and finally the protein in the ribonucleis acid	14275	0	0
6	Cells move across the membrane with the use of osmosis, diffusion, and homostasis. Osmosis is when the cell determines what is, and is not, allowed to cross the cell membrane. Homostasis is when the cell is both equally stable on the inside and outside of the cell. Diffusion is when molecules are entering and leaving the cell.	14294	0	0
6	1.Transcription2.Translation3. Reflection	14298	0	0
6	1. Cell membranes that allow enzymes to move across the cell. 2. The nucleaus that controls all the chemical processes in the cell to maintain homeostasis.3. The cell wall that allows only certain enzymes to enter and exit the cell.	14311	0	0
6	with their body's, through blood, and organs	14319	0	0
6	One way is the tRNA moves proteins to the cytoplasm.Another way is through Active Transport, Active Transport uses energy to force substances out of the membrane. Passive Transport also moves substances out of the membrane, but it does not require energy.	14334	2	2
6	the flagellim is used to cause the organism to move about .	14337	0	0
6	flagellum	14344	0	0
6	Active transport because with active transport the substances are active, and moving around, and not just staying in one place.Deletion because it deletes some of the substances if they get in the way of something, that way they can keep moving.Diffusion because substances are kept moving, and don't just stay still.	14348	0	0
6	Osmosis is the diffusion of water across the cell membrane.By Mitosis, the cell is divided, leaving more room for increased production and disposal of substances.The Golgi apparatus is used to diffuse substances, such as removing damaged proteins from the cell.	14357	1	1
6	reproduction,respiration,proteins	14374	0	0
6	The first process is to move it to the mitochdaine. Then they move it the to ensumyes. The final movement they make is to the cell membrane.	14378	0	0
6	Cells use diffusion, osmosis, and facilitated diffusion to move susbstances across the membrane.  Diffusion and osmosis are types of passive transport.  Diffusion is used to regulate substances with the outside environment using the cell membrane while osmosis transports water and other liquids through the membrane.  On the other hand, facilitated diffusion is a type of active transport.  It is also a type of diffusion, albeit it uses energy to transport the substances out of the cell.	14396	0	0
6	1.they gather protin from out side.2.they keep moving from one place to another.3.it all process the membrane.	14417	0	0
6	Anaphase, metaphase, telaphase	14425	0	0
6	Active transport- uses energy to move subatances across the membranePassive transport- does not use energy to move substances across the membraneOsmosis- the diffusion of water across the membrane	14426	3	3
6	There is active transport, passisve  transport, and diffusion.	14428	0	0
6	Osmosis is when water comes through the cell membrane.  Other times the cell opens its membrane and allows a substance to enter.  The last type is when a substance exits the membrane may open up to allow the object out.	14436	1	1
6	Three processes used by cells to control the movement of substances across the cell membrane are diffusion, osmosis, and endocytosis. Diffusion is the movement of molecules across the cell membrane from an area of high concentration to an area of low concentration. The goal of diffusion is to maintain an equilibrium, and have everything balanced. Osmosis is the diffusion of water across a selectively permeable membrane. Both osmosis and diffusion are forms of passive transport. Passive transport requires no energy from the cell to move substances across its membrane. However, endocytosis is a form of active transport. Endocytosis is the process of moving larger molecules, such a food into the cell. This takes more energy from the cell, and may use enzymes to quicken the process.	14444	3	2
6	transportation	14445	0	0
6	Facilitated DiffusionActive TransportPassive Transport	14456	0	0
6	meiosismeitosiscell division	14459	0	0
6	1) nuclear pores move things in and out of the nuclues2) the cell membrane allows substances to m ove in and out of the cell while protecting it from some substances3) Cytoplasm holds everythiing in place in a cell	14460	0	0
6	active transport- active transport is when a cell uses energy to transport substances across the cell membranepassive transport- passive transport is when a cell transports materials across the cell membrane without the use of energyosmosis- osmosis is the transport of substances through the semi-permeable membrane (water)	14473	3	3
6	osmosis- is the movement of water through the cell membrane. diffusion- is the movent of any substance through the cell membrane.flegella- the flegella are arms that help the cell move and let substances travel through the cell membrane.	14481	1	1
6	The to enter the cell you have to use ATP energy.	14483	0	0
6	Osmosis: Osmosis is  a type passive transport across a barrier, such as a cell membrane.  This type of transport does not require any energy.Phagocytosis: Phagocytosis is a process by which a cell surrounds a material and brings it into the cell.  This process is a type of endocytosis and this process requires energy. Endocytosis: In this process, a cell brings in molecules or substances, which requres energy.  This is a typw of active transport.	14512	2	2
6	Mitochondria, Golgi Body, Mitosis	14524	0	0
6	-selective penetration; where a cell decides which substances can enter and which can not (?)-cilia; hair-like structures that move the cell (?)-flagellum; also hair-like structures that move the cell (?)	14534	1	1
6	cells change prokaryotesprotects nucleuscirculates other cells	14543	0	0
6	One process that a cell uses to control the movement of substances across the cell membrane is the surface area. If the surface area is too large, the cell won't let any more substances move throughout the cell membrane. Another way is facilitated diffusion. This controls the amount of substances that are allowed to enter the cell.	14545	1	1
6	There is Active transport, Passive transport, and something else.	14547	0	0
6	The cell can use passive transport, which allows things to freely move in and out of the cell given the concentration of the matter. Active transport uses energy from the cell to move materials against the gradient. One form of this moves materials out, called endosymbiosis. Another form moves them inside the cell, called exosymbiosis.	14548	1	1
6	-blood flow-energy-vains	14554	0	0
6	metosis interphase and prophase	14563	0	0
6	MITOSIS  REPRODUDTION  EVULUION	14567	0	0
6	one thing they do is keep certain things that the cell wants in or out. This is done by a gate like strycture on the surface od the membrane. this mainly allows almost all things to get in and certain things to get out.	14578	0	0
6	The three process used by cells to control the movement of substances across the cell membrane are glycolysis, osmosis, and diffusion.  Glycolysis is anaerobic, meaning that it does not require oxygen.  Osmosis is the taking in and removing wastes or materials from the cell.  Diffusion is the movement of water across a cell- may have to deal with a hypertonic or hypotonic solution.	14579	0	0
6	The cell uses osmosis and facilitated diffusion to move substances across the cell membrane.	14599	0	0
6	One process is that the cells use their functions to move substances. Two is that differnet organelles help the cells move the substances. And the third is that the cells guide the substances to their destination.	14600	0	0
6	The carbon chains on the end of proteins on the outside of the membrane filters what goes in and out of the cell. Proteins on the inside of the membrane block out some of the things that may find a way through transprort proteins. Finaly there are proteins on the inside of the cell which can stop anything from getting into the cell.	14606	0	0
6	One process that the cell uses to control movment of substances across the cell membrane is by osmosis. Another procces is faciliated diffusion. The last process of movement of substances across the cell membrane is diffusion.	14611	0	0
6	Three processes used by cells to control the movement of substances across the cell membrane are using the tRNA to move nucleotides	14639	0	0
6	Molecules stop certain substances from getting accross, but sometimes the substances can sneak in when another substance in going in.	14651	0	0
6	-to keep there cell in the same shape.-to find food.-to keep diffrent bacteria out of people system.	14655	0	0
6	Diffusion is used which is the movement of particles across a semi permiable  membrane from a high to low concentration. Osmosis is also used which is the movment of particles from hypotonic and hypertonic solutions.	14656	1	1
6	RNAMRNADNA	14661	0	0
6	Process one- nuclear envelope and pores allow things to travel in and out of the nucleus. Process two- Cell membrane protects the cell and also decides what can go in and out of the cell.Process three- osmosis	14675	0	0
6	1. Selective Permiability - The cell lets in certain substances through the cell membrane.	14685	1	1
6	crawl,slide.pull selves with phlagellum	14688	0	0
6	The cell chooses what can move across the cell membrane by the chemical or by the size of the substance.	14708	0	0
6	* Flagella controlls the movement	14724	0	0
6	1)anaphase2)telophase3)manaphase	14729	0	0
6	The process used by cells to control the movement are substance of diffusion, the shape, and the size.	14733	0	0
6	Things can get in and out from passive transport.Things can get in and out from active transport.	14735	0	0
6	1. Osmosis- particles move through the cell membrane if there is an unequal concentration of the substance on each side of the cell membrane.2. Proteins- a cell could call some protiens to move particles from outside of the cell inside the cell or vice versa. The proteins would sit on the membrane and shoot particles through.3. phagocytosis- a cell will 'eat' another cell.	14742	0	0
6	The cell stretches its body to move .	14747	0	0
6	the cell membrane is permeable and allows substances to enter and leave the cell.	14749	0	0
6	One process used by cells to control the movement of substances is Mitosis, which splits the cells. Another process is Miosis which splits the cells again, and the third process used by cells is Mutation.	14771	0	0
6	Cells have receptors on their outside, that are in the phospholipid bilayer, that only allow substances in if they match up to the receptors perfectly. Cells also use a process in which they form a 'bubble' around a substance (endocytosis) that they want to bring into the cell (this uses ATP). Another process that cells use to control the movement of substances across the membrane is exocytosis, which is when the cell gets rid of substances by forming a 'bubble' around the substance and sending it out of the cell. This is very similar to endocytosis except it is used for the opposite goal.	14772	2	2
6	Cells use the membrane to move transporter proteins in and out, Also marker proteins.	14775	0	0
6	They can be carried by another organism or could be floating around. Get attached to something then it moves them.	14776	0	0
6	cellular respiration which helps the movement digestive system, how the organism gets food and how it reproduces	14782	0	0
6	Ossmoses: Passing through cell wallDiffusion: Things leaveing cell wallFasilitated Diffusion: the carefull release or inbranment of stuff through cell wall	14797	0	0
6	The cell membrane lets stuff in and out.	14803	0	0
6	1.Bacteria2.Viruses3.Vacoules	14822	0	0
6	1ENERGY2FOOD3MUCELS	14827	0	0
6	Osmosis - the movement of particle from greater areas of concentration into areas of lesser concentrationcell permeability - the cells way of controlling what is allwoed through, and what is notpinocytosis - the movement of of small particles across the plama membrane	14828	0	0
6	There is the cell membrane, the cell wall, and the membrane bound organelles.	14836	0	0
6	There are three known processes used by cells to control treh movement of substances across treh cell membrane. One of these ways is that treh cell forms itself around treh substance and then closes in, with treh cell membrane moving around it, therefore positioning it inside treh cell. Another way is that treh cell 'opens up' when treh substance or substances come in contact and then 'closing' after it reaches across treh cell membrane. Another way is that treh cell would move to it, and then absorbs it, in a way of speech.	14841	0	0
6	Diffusion is when the particles pass through the membrane. Osmosis is when water carries the particles in through the membrane. Facilated diffusion is when particles are attatched to something else that is going into the membrane.	14850	1	1
6	ribosomes transport substancestRNA read themrRNA tells them where to go	14859	0	0
6	Three processes a cell uses to move particles through the cell membrane are through the Carrier portein, Pump protein and the Tunnel Protein.	14863	0	0
6	The cell membrane allows the material to get into the cell and materail from the cell to move out. The sugars go to the protein and forms the cell's protective layer. Then the enzymes go through the gateway type of process which allows enzymes to switch from one side to the other of the cell membrane. Then the cell membrane lets material go out of the cell and inside of the cell.	14869	0	0
6	mitochondia moves stuff, lysosomes move things, and chlorophyll moves items.	14872	0	0
