QuestionId	Answer	AnswerId	Score1	Score2
6	A cell membrane is whem the cell are attack the membrane for the cell to move thought the membrane. and how it is the number one why for the cell membrane to be attack for the cell to get out.	14884	0	0
6	The cell membrane is used to control the movement of substances across a cell. The cell membrane may block out harmful substances, and the cell membrane will also let substances needed for the process into the cell. The cell membrane is very permable.	14887	0	0
6	blood flow.	14903	0	0
6	first thing would be there round small shape helps them flow all around the body.second thing would be the mebrane inside the cell, it can give enrgy to help it move and live.therd thing is the function it has in the body. only so that the body notice what it is and it allows it to get to where it needs to go.	14913	0	0
6	There is a protien. requires energy, water can pass through plasma membrane easily.	14915	0	0
6	1. Kreb cycle when they move carban and oxygen around to make ATP2. Calvin cycle when they use oxygen to make a little ATP3. Active Transport that moves the cells around to make ATP	14934	0	0
6	mitosis, they seperate to make it easier to pass things through the cell. They are selectively permeable which alows them to chose what gets in and out of the cell.	14943	0	1
6	The flagellum, uses its tail like structure to move around. The cillia uses its hair like substances to move around in the cell.	14956	0	0
6	Diffusion which is a process where substances are transported across the cell membrane.	14958	0	0
6	Osmosis, Diffusion and Active Transport.	14984	0	0
6	cytoplasm keeps things where they are.	14998	0	0
6	First of all, cells have a semi-permeable membrane that allows only what the cell wants to allow in.  Second, cells use the cytoplasm in the cell to move and hold different substances and items that are in the cell.  Last of all, some cells have a cell wall that doesnt allow anything in, except for a few spots where the wall is discontinued.	15018	1	1
6	Wall cells are in plants to keep the strucure of it.	15025	0	0
6	Mitochondrian, plasmids, and the ribosomes.	15039	0	0
6	1.substances move through the organelles2.tRNA transfers it across the cell3. transcription	15051	0	0
6	Tails are used to move cells around.They also use tiny hairs to swim around.	15084	0	0
6	There is a endoplasmic reticulum that acts like a guide in the cell. Then there is flagella in the cell that helps control the movement. There is also cytoplasm that helps the control.	15090	0	0
6	The three processed used by cells to control the movement of substances across the cell membrane are; mitosis, meiosis, and cellular respiration.	15094	0	0
6	The plasma on the out side of the membrane keeps certain things from getting in and or getting out.	15095	0	0
6	they use there body movments	15103	0	0
6	movement, reproduction, and respiration. Movement to move, Reproduct to make more, and respiration to help the body.	15106	0	0
6	The cell wall is one-it only lets certain substances enter the cell.The cytolasm is a substance that fills the cell with a jelly material.The vacuoles moves throughout the cell getting rid of certain substances.	15111	0	0
6	MIOSISOSMOSISREPRODUCTION	15118	0	0
6	anaphase interphase and prophase	15121	0	0
6	The three processes are diffusion, faciliated diffusion, and osmosis.	15123	0	0
6	Three processes used by the cell to control movement of sudstances would be citoplasma, nucius, and mitocondrean.	15134	0	0
6	MRNATRNARNA	15146	0	0
6	absorb food	15151	0	0
6	Osmisis, one using energy, one not using energy	15161	0	0
6	cell division, cellular respiration, cell wall	15173	0	0
6	Cell membranes let go of waste, eat and engulf food and can block bad stuff from getting in.	15176	0	0
6	They are transfered.They carry the substances.	15177	0	0
6	Meiosis is used throughout the cell membrane to control and develop more cells. MRNA and RNA are used as messengers to carry the information to the needed destination. Lastly, the information is received and it has ended,	15183	0	0
6	They use the pump function which pumps out solutes so it won't become overfilled with too much water. They use osmosis which is the movement of water against the natural flow. They have transport proteins which allow things to come through the cell.	15194	0	0
6	They use a system and it gets rid of the stuff that the cell doesn't need, it gets food and stuff like that for the cell to survive, and it helps the cell reproduce.	15199	0	0
6	energybloodother	15209	0	0
6	Three processes used to control cell movement are,	15213	0	0
6	On the cell membrane there are little holes that are selectivley premable, which allows only certian things to cross and not cross into the cell.	15217	1	1
6	Division: the cells move upon division as well as reproducing.Entering: the cell membrane allows certain things to go in and come out, then they'll move on to the next thing.Lock-and-Key: the cell allows a ligant to connect and bring glucose in the cell.	15239	0	0
6	the three things used by cells are cellular resperation	15244	0	0
6	Facilitated Diffusion- allows only certain molecules through membrane and is not going against concentration gradient.Osmosis- the diffusion of water across a membrane.Protein channels- integral and peripheral proteins carry substances into and through membrane into the cell.	15255	1	1
6	cell membrane allows certain materials to move around the cells	15260	0	0
6	One way of movement is the use of flagellum witch is a long tail like structure the moves behind the cell.The second is cilia witch are like tiny hair like structers that are all over a cell witch give it mo bilty.	15262	0	0
6	osmosisactive transportpassive transport	15266	0	0
6	The cell membrane is a thick-layered 'wall' that can sometimes prevent what goes in and out of the cell.  It also detects what is suppose to get into the cell.	15271	0	0
6	the nucleus controls everything,the mitochondria tells wat enters and leaves the cell.	15277	0	0
6	Photosynthesis, Cellular Respiration, and the Phosphorus cycle.	15287	0	0
6	1.resperation is one way it takes substances across the cell2. food gathering also is another way when it gathers the food3. cell selection is another way they select what they want	15295	0	0
6	Facultative diffusion- Particles moving through the protein channels from hig to low concentrationDiffusion- something moving through a cell membrane from high to low concentrationosmosis- water moving through a cell membrane from high concentration to low concentration	15327	3	3
6	One, they could move all around the cell membrane and end up in nucleus.Two, they could pop out of the cell membrane and be left outside of the cell membrane.Three, they could just stay in the cell membrane.	15333	0	0
6	Cell WallVacuole	15337	0	0
6	The cells move by the flow of cells, cells do their certain jobs, and cells protect the membrane.	15351	0	0
6	one way is when cells go and they start to divid and split a part to make new cells	15356	0	0
6	Sugar cells, Tubicles, and charbohydrates	15359	0	0
6	Cell wall, it helps keep the substance in the membrane,	15365	0	0
6	One process is through the use of cyclins. Another way is through the cytoplasm. Lastly is by use of carrier protiens.	15373	0	0
6	Osmosis is the difussion from one membrane to another.Active transport is the active use of ATP to transport materials.	15394	1	1
6	They slide because its slippery. Its really cramped in there because every thing is so close. Then they are molded into place and they stay there untill there job is complete.	15397	0	0
6	active transport passive transport osmosis	15409	0	0
6	The cell membrane tries to equal up the movement of substances from side to side. First the subtances flow freely through the membrane. Then, when the cell has gotten enough substances the membrane sends substances out of the cell.	15423	0	0
6	reproduction	15427	0	0
6	One use would be to remove wastes. Another use would be to recieve proteins or other necessities. Finally, it can be used to keep out harmful substances.	15439	0	0
6	The nucleus controls all the cells functions The membrane controls what goes in and out of the cellThen I guess that the mitochondrian control the food intake.	15440	0	0
6	Active Transport allows substances to move across the cell membrance from low to high concentration. Active Transport uses energy.Osomis allows substances to move across the cell membrance without using energy. Therefore, moving from a high to low concentration.Diffusion allows substances to move across the cell membrane by diffusing them across the cell.	15461	1	1
6	The three processes used by cells to control the movement of substances across the cell membrane are the following:1. osmosis2. meiosis3. mitosis	15462	0	0
6	The cells will control movement by the cell wall, the cell membrane, and the flagelluim.	15470	0	0
6	Well the cell have to move though the membrane to the chain of reaction.	15481	0	0
6	Cells have a lipid bilayer which helps to move things through the cell membrane. A cell's membrane is selectively permeable. Cells also use passive and active transport. Passive transport requires no energy. Some form of passive transport include osmosis, diffusion, and facilitated diffusion. Active transport, unike passive, reguires energy to move things through the cell membrane.	15488	2	2
6	1) Cellular Respirtaion 2)	15495	0	0
6	passive transportactive transport	15511	0	0
6	The cell wallplasma membrane	15528	0	0
6	-Nucleus allowing substances to enter through the membrane.-Cell membrane allowing substances through-Proteins leaving the membrane.	15529	0	0
6	1.water for movement2. food for energy to move3. brain tells the thing what to do	15530	0	0
6	cells help things move through the body so that they can get to the places they need to be.cells store nutrienrtsthey store food	15533	0	0
6	-Fission;  The incoming substances fuse with the cell membrance and enter the cell.-Lipids;  Substances go through the membrane through hole-like structures.-Packaging;  A substance goes into the membrane, which encases the substance.  Then the package is dumped inside the cell.	15537	0	0
6	three processes that cells use to control movement is active transport which uses energy to go against the current, passive transport which requires no energy because is goes with the current, and transport protiens which carry substances through and across the membrane.	15566	2	2
6	Cells control the movement by carrying the information to other parts of the cell.	15573	0	0
6	INTO A CELL- SO THAT THE INFORMATION CAN BE PROSESSED.OUT OF A CELL- SO THAT IT CAN GET RID OF WASTE.SHARED- SO THAT IT CAN RELATE INFORMATION.	15574	0	0
6	They have got flagella to help them move around the cell.	15579	0	0
6	movement, repridouction, respirtaion	15590	0	0
6	The cell uses the movement of the liquid to move	15608	0	0
6	The processes used by cells to control the movement of substance across the cell membrane by meiosis. They let the cell move or the cell would have a flagella.	15609	0	0
6	The cell membrane is a jelly like substance.	15671	0	0
6	1) send signals to nerves2) Move itself places3) Make whole groups of cells	15689	0	0
6	Cells use diffusion to get materials through the cell membrane. They also use osmosis to get water in and out of the cell. Some also use facilitated diffusion which uses energy to move things.	15692	1	1
6	prophase, anaphase, telophase	15699	0	0
6	There is a process called osmosis to move substances in and out of cells. Cells also have proteins that move substances around the membrane. Lastly, cells use channel proteins, which channel energy.	15700	0	0
6	THE GOLIGI APPERTIUS	15716	0	0
6	One way the cell controls the movement across the membrane is by knowing where to go. Aniother way is by swimming to where it needs to go, and the last way i moves is by just moving there.	15725	0	0
6	PHOTOSYNTHESISFLAGELLUM	15727	0	0
6	Protien moves aross the cell membrane when something is need  to move the cell membrane will only let certain things in and out	15729	0	0
