QuestionId	Answer	AnswerId	Score1	Score2
5	it conects to the DNA and makes mRNA, the mRNA than takes messages to other parts of the cell, it goes through the nucleus, through the cell membrane, and than off to the other parts of the cell.	12574	0	0
5	Protien synthesis has four major steps, mRNA, moves the protein, tRNA allows for the protein th tanscribe, rRNA creates the DNA in the RNA, gRNA moves it into the cell	12575	0	0
5	IT ENVOLVES ALOT	12581	0	0
5	The synthesis will start to pull apart then it will split into two. It will then pull apart than start all over again.	12583	0	0
5	ProephaseMetiphaseAntiphaseTeliphase	12591	0	0
5	~Protein arrives at mRNA~Proteins get ready to get copied~Potein gets copied~Protein leaves mRNA	12593	0	0
5	mRNA and protein syntheses are the main part.	12607	0	0
5	mrna rna dna	12614	0	0
5	1.The mRNA leaves the cell and copies the DNA into RNA swapping A's for T's and C's for G's.Then it takes it to the place where the proteins are being assembled and a tRNA stamps it onto the proteins.	12616	0	0
5	transperation: when the mRna leaves the nucleusRestoration: When the mRna enter the mitocondria	12617	0	0
5	TRNA RNA DNA	12629	0	0
5	Protien synthesis begins with the cytoplasm going toward the ribosome.	12641	0	0
5	mRNA goes to the ribosome to get attached to an amino acid	12655	1	1
5	When mRNA leaves the nucleus, tRNA transfers information to the nucleus and translation occurs. The amino acids are then read and are distributed. Transcription splits the amino acids and rRNA makes the new protein.	12662	0	0
5	After the mRNA leaves the nucleus it travels to the gose to the ribosome. There the strand is pulled apart and then connected by hydrogen bonds to another strand of mRNA. The leftover strand gets sent to the mitocondria where is is broke down. Next the new strand of mRNA is sent back to the nucleus.	12682	1	1
5	1st it leaves the nucleus 2nd it makes it way through the cell3rd the mrna is made into protein4th  the protein that ha been made is used throughout the body	12685	0	0
5	the first step is it reads the RNA.Then it transcripe it and groups codon.The third step is translate the new RNA. Then last it is changed and the RNA is ready to go.	12689	0	0
5	mRNA leaves the nucleus with the DNA information because DNA can't leave the nucleus. Once the mRNA has taken the information to its destination, tRNA then takes place to bring the correct amino acids in respect to the letters from the mRNA. After this is done, proteins are made.	12702	0	0
5	protecting them	12727	0	0
5	mRna leaves the nucleus, and enters the cytoplasm. From there, it attaches to a ribosome. Then it finds the correct tRna molecule to attach to and it bonds to this tRNA molecule by a peptide bond.	12729	1	1
5	The cells getting Rna to make it.The building protein.The copying of the blueprints out of the Dna to make portein.	12746	0	0
5	#NAME?	12747	0	0
5	mRNA is messenger RNA.	12748	0	0
5	mRNA leaves the nucleus. Then it goes to a strand of DNA and attaches to it. It turns the amino acids in proteins. Then the cell stores the proteins and uses them.	12756	0	0
6	The cell membrane uses enzymes.	13977	0	0
6	1. the cell can control the membrane cause its part of the cell2. the cell can control the membrane like we can do same to ours3.the cell sends a it threw littel tiny cells to the membrane	14000	0	0
6	Cells have protective layers that could prevent harmful substances from entering throug the cell membrane.	14005	0	0
6	Three processes used by cells to control the movement of substances across the cell membrane are Diffusion; paricles moving from high to low consentration. Osmises;	14006	1	1
6	One is by moving the cell away from harmful areas. Another is moving the harmful stuff from the cell and bringing in the good stuff. Lastly the cell can move its self to places where it can get more food or water, etc.	14020	0	0
6	They can control them, they can redirect them, and they can get rid of them.	14044	0	0
6	Diffusion- The cell transports the material across the cell membrane so the concentration is equal on both sides.Osmosis- The transportation of water across the cell membrane.	14058	1	1
6	Meosis, is one way that cells move substances. Mitosis is another way that cells move substances. The last way that a cell moves substances is telephase.	14064	0	0
6	electric currents through the spinal cord going directly to the brain.	14068	0	0
6	Three processes used by cells to control movement across the cell membrane are, first, osmosis in which water moves in and out of the cell through the membrane. Second,	14075	1	1
6	Passive TransportActive TransoprtDiffusion	14082	0	0
6	Three processes are:1. mitochondrian- 2. lysosomes-3.	14087	0	0
6	Three processes to control the movement of substances across the cell membrane are the nucleus, flagellum and ribosomes.	14089	0	0
6	First The organism takes in the food, Then it breaks it down, Finall decomposure takes place.	14102	0	0
6	proteins and sugars	14103	0	0
6	the cell wall only lets in the good things.the cell membrane helps the other parts of the cell.dna  also go though the cell membrane to get checked out for rna.	14106	0	0
6	One way to control the movement of substances across the cell membrane is prophase, menaphese, and telephase.	14109	0	0
6	osmosis the movement of waterDiffusion the movements of particles from high to lowactive transport is when the cell uses energy to open and close and allow certain particles in and out	14110	2	2
6	some process' can be used to move the substances across the cell membrane. one is the funtion of the cell two is the cells cytoplasm and three can be used for the making of the cell that makes the cell come alive and make everything happen	14114	0	0
6	Flagellas is a tail that allows the cell to 'swim' around. Slime allows cells to move around. And little tenticles on outside of cell to help swim around.	14121	0	0
6	reconizing the celllets out emzymes to attack	14123	0	0
6	Diffusion, movement from high to low concentration.  Facilitated Diffusion, energy and protein is moved from low to high concentration.  Osmosis, is the movement of water through the cell membrane.	14125	2	2
6	bloodnervescell tissue	14133	0	0
6	mitosis. The cell splits up to a sister, as they call it.miosis. The sister chromatid grows	14138	0	0
6	Selective permiablity, which lets only certain things pass, like a window screenendocytosis, brings in certain substances by opening the plasma membrane and absorbing themexocytosis, uses the same process as endocytosis except its removing substances from the cell	14140	1	3
6	One process is osmosis, which helps moves water in and out of the cell. Another process would be going through the protein channels, this moves things in and out of the cell. A third process would be isomosis.	14147	1	1
6	Cells use the process called diffusion.  Diffusion is used to move the substances across the cell.Osmosis is used to move water across the cell. Translation occurs to move substances.  Transciption also moves the substances across the cell membrane.	14149	1	1
6	#NAME?	14168	0	0
6	difusion. facillitated difusion. osmosis.	14182	0	0
6	1. Osmosis, the equilzation of water in and outside the cell.2. Organelles, which prevent unessesary functions.3. The Nucleus, the 'brain' of the cell.	14192	0	0
6	Golgi Bodies for packaging waste products. Lysosomes used to eat away at the wastes. ER used to move ribosomes.	14200	0	0
6	They transfer the DNA. They store proteins. And collect enzymes. They do all of that so that the cell can function.	14213	0	0
6	Three processes used by cells to control the movement of substances across the cell membrane are flagenal, bristles, and rebosomes.	14214	0	0
6	three processes used by the calls to control the movement of substances across the cell membrane are cellular resparation, photosynthesis, and cell division.	14216	0	0
6	one process used by cells to control movement of substances across the cell membrans is the cell wall. another processes but wich cells use to control the substances that cross the cell membranes are the phospholipids that line that cell wall these help keep unwanted thing out as well. lastly one last process used by cells to control the movment of substances across the cell membrans are membranes thar act as little doors that open and close to let thing inside.	14217	0	0
6	The three processes used are TRNA, DNA, and flagellum to control the movement of substances through the cell membrane.	14239	0	0
6	Organelles.	14241	0	0
6	1. the cells allows what goes into the membrane.2. the cells allow what goes out of the membrane.3. it controls how the membrane allows the cell to reproduce.	14242	0	0
6	Osmosis, is the passing of things across a membrane. Meiosis, and Mitosis.	14244	0	0
6	The cytoplasm moves the ribosome around in the cell. The endoplasmic reticulum moves the ribosomes into the nucleus. The golgi apparatus removes the unwanted substances out of the cell.	14251	0	0
6	Osmosis is when water passes through a barrier, which is selectively permeable in the case of a cell. Diffusion is when the cell tries to reach equilibrium by choosing what enters the cell. Homeostasis is when an organism is in equilibrium with the environment.	14272	1	1
6	Some cells have a cell wall. A cell wall controls what enters and exits a cell. The cell membrane is very thick and can be very sensitive in what it receives into it.Cell membranes only have openings, like doors, to recieve certain sized things so anything unwanted can be left out.	14288	0	0
6	Three processes that are udes by the cell to move substances across the cell membrane are the cell wall,	14295	0	0
6	Passive transport, which lets substances across the cell all the time.  Active transport, lets substances move across the cell as well, but active transport isn't used all the time.  Diffusion, which is the movement of higher concentrations to lower concentrations.	14296	1	1
6	They use mRNA to carry messages to the mitochondria and the cell somehow use that message or energy.	14297	0	0
6	These include passive/active transport, facilitated diffusion, and osmosis. Passive transport does not require energy, but active transport does. Passive transport is high to low concentration, and active transport is low to high concentration. Facilitated diffusion is when a protein in the cell membrance is used to aid in the transfer of substances. Osmosis is the diffusion of water across the cell membrane.	14307	3	3
6	transportation	14315	0	0
6	One way they try carry the substances across the cell membrance is that the cells will go through a special kind of door that only allows a certain kind of substance in.Another way is that the special exits that let out a certain kind of substance.And finally, the third one, the way that they are moved into the cell through a door that allows both subtances into the cell.	14316	0	0
6	slow the movement down they also can totally stop moving ment or they can let it go right through	14331	0	0
6	The three processes used by cells to control movement of substances across the cell membrane are reproduction, storing energy and movement.  In reproduction the cell produces offspring.  Storing energy requires the cell to become more active.  Movement requires the cell to adapt to different places in the cell.	14366	0	0
6	Homeostasismetabolism	14368	0	0
6	A cell consist of many parts to protect things from getting in. One part is the cell membrane. The cell membrane acts like an outer lining to protect the cell from harmful things getting in. The mitocodria, is another part. It carries out waste from the cell. The final part is the cell wall, found only in plants. This allowes a double protection feature to be sure things don't get in.	14386	0	0
6	rnamrnadna	14410	0	0
6	The three mitocondria, amino acids, and dna	14422	0	0
6	Active transport- uses energy to move subatances across the membranePassive transport- does not use energy to move substances across the membraneOsmosis- the diffusion of water across the membrane	14426	3	3
6	MEOSIS,MIEOSIS,MUTATION	14429	0	0
6	The plasma membrane will only let certain things in and out of the cell through	14441	0	0
6	Facilitated DiffusionActive TransportPassive Transport	14456	0	0
6	Flagellum is a tail like structure that helps the cells move. Sprilla are tail like structures all over that help it move more quickly. Coci is a movement that the cell uses to move all around.	14461	0	0
6	One of these ways is by the cell membrane. This organelle moves and allowes acces for food for the cell . The other one is cloralplast. This is a jell like thing in side the cell and it moves material through out the cell after the substance moves through the cell membrane.	14475	0	0
6	Three prcesses used by cells to control the movement of substances across the cell membrane are: defication, ribosomes, and cell pores.	14476	0	0
6	Diffusion controls whether certain substances move across the cell membrane.Osmosis is the movement of water across the cell membrane.	14479	1	1
6	Cells can control which amino acid strains pass through the membrane as directed by the nucleus of that cell.	14489	0	0
6	Three processes used by cells to control the movement across a cell membrane are osmosis, diffusion, and active transport.	14495	0	0
6	Transportation they move all around the placeThey soak up nutrientsThey have have ribomsomes They collect enyzymes	14516	0	0
6	osmosisdiffusion	14523	0	0
6	endocrytosis- chooses what goes inexocytosis- choose what goes outselective permeabilty- chooses what goes in and out of the cell	14526	1	1
6	they use their tail for movement.proteinsnucleus	14537	0	0
6	Diffusion and osmosis are two types of movement of substances across a cell membrane. diffusion is used to diffuse outwards. osmosis is used to slide over the membrane.	14559	0	0
6	1. Active Transport: Used to move substances by way of transport protien against the concentration gradient. Energy Required.2. Passive Transport: Used to move substances through the membrane without using energy.3. Osmosis: Moving water across the membrane by way of carrier protiens.	14568	2	2
6	endocytosis-moving materials into the cell.excocytosis-moving material out of the cell.sodium/potassium pump	14572	0	0
6	cells carry them to the places they need to beas the cell goes across the membrane as the substance is being used. the substance would be used up again after the first time.	14595	0	0
6	The cell uses osmosis and facilitated diffusion to move substances across the cell membrane.	14599	0	0
6	the cell has a seletively permeable membrane and uses osmosis and reverse osmosis to move material across the cell membrane.	14607	0	0
6	1. Mitochondrian carry energy.                2. Flagella makes sure everything moves properly in the cell.	14609	0	0
6	The lipid bylear acts as a wall to block out unwanted particles and if it wants something to leave or enter it will make things like pockets and allow the particles to enter the pocket and it will close itself and allow the particle to leave. The cell also uses osmosis to allow the water to go through the cell.	14615	2	1
6	The cell uses the Chloroplast to move things quickly and efficently.  They also use the cell wall to keep things in so they can't loose anything.  The membrane tells everything where it needs to be and where to go.	14626	0	0
6	Cell wall blocks particles.Cell membrance controls the what goes in and what comes out.Cytoplasm helps decide.	14640	0	0
6	RNAMRNADNA	14661	0	0
6	The three processes used by the cell are the making of proteins,the packing process,and the moving of the proteins out.	14662	0	0
6	The Flagellum is used to help the cell move around, and move it can move other organisms.	14668	0	0
6	1. It moves by the way the chromatids attach to the substances.2. It also moves by the nucleus drawing it closer to it.3. It also moves by the ribosomes that help the chromatids move it.	14669	0	0
6	Three processes used by cells to control the movement of substances across the membrane are: the cytoplasm slowing the substances and acting like a jello to control the movement, endoplasmic reticulum, and the golgi apparatus.	14674	0	0
6	Cells use processes to move substances across the cell membrane. Three ways to do this are active, passive, and diffusion. Active transport requires energy, this may use transport protiens. Passive transport does not require energy, the molecules just pass through the membrane. And diffusion is the the net movement of particles from an area of high concentration to an area of low concentration.	14680	3	3
6	The cell uses different types of proteins such as transport protein to decide what comes in or out. They cell can uses moving organelles such as a flagella to move to keep things from entering.  It has a double phosolipid bilayer to keep items from just coming in.	14693	0	0
6	respiration, enzymes, and ATP	14699	0	0
6	Mitocondrian, Golgi apparatus,	14752	0	0
6	isotonic: where there is the same amount of a substance in and outside the cell so the volumes are the sameHypertonic: where that amout of a sunstance is greater on the outside of a cell so it moves in through the semipermiable membraneosmosis: where a substance moves in and out of the cell	14763	0	0
6	The use of RNA  MRNA     and singnals let iff by DNA	14773	0	0
6	One way would be be active transport. Another way would be by	14774	0	0
6	They have multiple cells stop other cells like they were border patrol.	14800	0	0
6	The cell membrane, the cell wall and the chloroplast.	14820	0	0
6	One movement is passive movement. Passive movement alows substances to move freely through the cell membrane. The second movement requires an activation energy for substances to pass through. The third movement is when substances go through using proteins.	14823	0	0
6	Judges what it is that is trying to cross. Only allows a certain size of something to pass through. Membrane can tell if it is a bad thing. The membrane doesn't have to let everything in.	14826	0	0
6	In diffusion the surface of the cell decised what substances go in and out of the cell. In mitosis the things inside the cell are used to move and function in the cell.In meiosis sustances pass throught the wall of the cell and do tings that help the cell do things.	14829	0	0
6	There are three known processes used by cells to control treh movement of substances across treh cell membrane. One of these ways is that treh cell forms itself around treh substance and then closes in, with treh cell membrane moving around it, therefore positioning it inside treh cell. Another way is that treh cell 'opens up' when treh substance or substances come in contact and then 'closing' after it reaches across treh cell membrane. Another way is that treh cell would move to it, and then absorbs it, in a way of speech.	14841	0	0
6	One is the mitocondria which controls what goes in and out of the cell. Second, is the vacole which is the stomach of the cell. Last, is the membrane which is the control center of the cell.	14856	0	0
6	cells process things coming in and out of the call membrane, calls also	14871	0	0
6	miosis	14882	0	0
6	flagellun, cell membrane, cell	14896	0	0
6	One way would be that the plasma membrane controls what comes in and out of the cell. Another way would be from osmosis. Also a way would be through diffusion.	14897	0	0
6	Selective Permiability- selects what substances get in and out of the cellActive Transport- which requires movement and creates  an opening for substances to movePassive Transport- doesnt require movement of cells to move substances	14902	1	1
6	to transfer RNA	14928	0	0
6	Active Transport is one of the three. In active transport, the cell has to use energy to collect substances and pass through the membrane. This energy is needed due to the flow of substances outside the cell. The next process is passive transport. In passive transport, the cell does not need any force exerted to gather and allow substances with in the cell. This is because the concentration is much higher within the cell. The final process is osmosis, which is simply substances of higher concentration flowing into an area of lower concentration due to mixing, heat, or friction.	14933	2	2
6	The cell uses cilla no move around to get food. The cell also ueses things golgi apperates to move things out of the cell.	14937	0	0
6	mitosis, they seperate to make it easier to pass things through the cell. They are selectively permeable which alows them to chose what gets in and out of the cell.	14943	0	1
6	They can use their cilia, flagella or they could not move at all.	14969	0	0
6	THe three types are diffusion, facilitated diffusion, and active transport. Diffusion doesn't use energy to move substances. The movement will always go from high concentration of the substance to low concentration. Once the concentration of the substance reaches equilibrium, or is the equal, the substance will move back and forth equally.A specific type of diffusion is osmosis, the diffusion of water. Facilitaed diffusion is used to transport substances that canot go through te semipermeable cell membrane. It uses no energy because it still diffusion. It uses the channel protiens in the cell membrane so that the substance can pass through. Active transport is used when a substance goes from low to high concentration. This type of transportation does use energy because it 'goes against the flow.' It is used when a cell need to take in nutrients or get rid of waste.	14975	3	3
6	The cell is connected to the membrane and by chanelling the membrane it tells it to move. Protins also send messages to the cell to tell it to move. The cell and cells are linked and communicating all the time.	14976	0	0
6	a cell controls the movement so it can contrarn the so it can get DAN to the place it needs it.	14978	0	0
6	OSMOSIS	14985	0	0
6	1) blood vessels2) the brain  3) vessels	15001	0	0
6	Reproduction, dying off of old cells, and living	15010	0	0
6	1.cellular diffusion2.	15011	0	0
6	First of all, cells have a semi-permeable membrane that allows only what the cell wants to allow in.  Second, cells use the cytoplasm in the cell to move and hold different substances and items that are in the cell.  Last of all, some cells have a cell wall that doesnt allow anything in, except for a few spots where the wall is discontinued.	15018	1	1
6	One of the processes used by cells would be the The NUCLEOUS to tell the cell what to do. Then there is the FLAGELUM Which is the tail the moves to help the crell move around. The last one would be the CELL MEMBRAIN That holdeverytjing in and not floting out.	15026	0	0
6	Cells can multiply.Cells can help organs.Cells also move throughout the cell membrane in order to keep everything funtioning correctly.	15029	0	0
6	blood movement cells	15032	0	0
6	Difusion, helps move water based particels in and out of the cell. Osmosis:  move non water based particels in ond out of the cell.	15036	0	0
6	Endocytosis. Endocytosis is when the cell uses a vesical to transport large substances into the cell. Exocytosis. Exocytosis is when the cell uses a vesical to tranport large out of a cell.Ion channels. Ion channels only let certain molecules into the cell.	15055	2	2
6	osmosisexocytosis is where they take large objects out of a cell with vesiclesendocytosis is where the cell takes in objects	15066	0	1
6	The flagellum is used for movement across the cell membrane.Proteins.	15070	0	0
6	sperm and egs	15076	0	0
6	Osmosis is the process where water flows in and out of the cell membrane.Active transport uses energy to move molecules throught he membrane of a cell.Passive transport is a process where molecules move through the cell membrane without the use of energy.	15101	3	3
6	sillianucliotides	15129	0	0
6	equilibrilum	15139	0	0
6	The substances that move across the cell membrane are DNA, Protiens, and mRNA.	15143	0	0
6	The cytoplasm moves stuff across the membrane.	15148	0	0
6	They have layers which regulate what can enter and exit the cell membrane. They have a screen-like function that detects weather or not a substance is sizable to enter the membrane.	15156	0	0
6	The first procees used to control movement of substances across the cell membrane would be trascription, which takes protein and turns it into mRNA. Translation takes mRNA and decodes it for the cell to read and use. Osmosis is another process, used by cells. Osmosis makes the fluid in a cell try and reach equalibrium.	15162	0	0
6	There are three processes that I know of that are used by cells and they are passive and active. Passive means that the substance is able to pass right through. Active is when it has to go through a process to go through the cell memebrane. Diffusion is another one. Substances diffuse to go through the cell membrane.	15166	0	0
6	cell division, cellular respiration, cell wall	15173	0	0
6	Cell membranes let go of waste, eat and engulf food and can block bad stuff from getting in.	15176	0	0
6	Meiosis is used throughout the cell membrane to control and develop more cells. MRNA and RNA are used as messengers to carry the information to the needed destination. Lastly, the information is received and it has ended,	15183	0	0
6	tRNA transports proteins to the nucleusmRNA carries genetic information	15202	0	0
6	Movement in the membrane	15205	0	0
6	energybloodother	15209	0	0
6	Digestion.Respiration.Inversion.	15216	0	0
6	OSMOSSES' DIFUSSION AND THE MEMBRAINE	15221	0	0
6	The three processes used by cells to control movement of substances are mitosis, meiosis, and passive. Passive is when substances can get through easily. meiosis is also the process how cells divide as mitosis is too.	15224	0	0
6	the three processes used by the cells to control the movement are through protein chemicals, lysomes throughout hte cell and through the blood.	15240	0	0
