QuestionId	Answer	AnswerId	Score1	Score2
6	Diffusion- Sugar is absorbed into the membrane and travels down the gradient level.Faciliated Diffusion- Requires energy to move down the gradient.Active Transport- Particles are held in a 'pocket', then are brought to the membrane and are released out of the cell.	15168	1	1
6	Diffusion, which allows materials to pass in and out, osmosis, through which water passes through the membrane, and active transport, in which specialized processes transport materials past the membrane.	15174	1	1
6	Three processes that control the movement of substances across the cells membrain are equalibrium, the consentration gradiant and cell division. the consentration gradiant is when the partical move from higher consentration to lower consentration. If the cells consentration gradient is to high it can brust or if it is to small it will shring so it has to be normal.	15185	0	0
6	The way the cells move around.	15204	0	0
6	When a cell needs energy, or food, the plasma membrane lets the food inside of the cell where it is processed by mitochondria. On the cell membrane, there is a series of locking nodules that prevent unwanted substances from entering the cell. Also, things like cilia and flaggellum aid in cell movement and could also possibly aid in the movement of substances.	15222	0	0
6	golgi aparatus	15233	0	0
6	Division: the cells move upon division as well as reproducing.Entering: the cell membrane allows certain things to go in and come out, then they'll move on to the next thing.Lock-and-Key: the cell allows a ligant to connect and bring glucose in the cell.	15239	0	0
6	They control the movement by telling things where to go.	15247	0	0
6	The genetic information start out as combinations in the nucleus. When they are switched to MRNA also known as messenger rna that sends a message to the organelles stating that the genetic code needs a specific substance. The third process  is TRNA or transfer rna which transfers the message to the specific orgnelle. The whole process then repeats itself.	15250	0	0
6	-selction..the membrane choosess what substancess can come inside the cell -I dont know-I dont know	15252	0	0
6	Photosynthesis is the process in which an organism collects enegry from sunlight.Homeostasis is the process in which an organism stores and collects enegry.Another process in which an organism produces it's own enegry.	15263	0	0
6	There are different kinds of processes that cells use, in this case in humans, such as:1. The White Blood Cells control how much blood is lost and  they are in charge of healing the spot were it is cut.2. The Red Blood Cells controll the blood coming from the heart to throughout the body.3. The Brain Cells can control brain functions and how much blood is taken from the heart and aloud into the brain.	15268	0	0
6	Osomises- The balancing of water inside and outside of a cell or necleaus.I don't remember the other two.	15280	0	1
6	Proteins control movementNucleus controls the cellsDNA makes proteins	15285	0	0
6	if the object is small enough it can fit right through the cell membrane, but if it is a larger object then it has to wait to go through the holes that open and close.	15290	0	0
6	Active transport uses energy and goes against the gradient. Diffusion moves water from a high surface area to a low surface area. Osmosis also moves water from a high surface area to a low surface area.	15298	1	1
6	One process used by the cell to control movement accross the cell membrane is through energy. The cell uses its energy to control the movement across its membrane. Another way is by endocytosis. Endocytosis helps bring things into the cell. Lastly, there is exocytosis. Exocytosis is when things are being removed from the cell.	15313	0	1
6	The three processes include tRNA, mRNA, and rRNA.	15322	0	0
6	RNA, Vacoules, & proteins.They each move things across the cell.	15324	0	0
6	Cell WallVacuole	15337	0	0
6	They use diffusion, to bring things in and out of the body. They use fission to move things around in the body.	15348	0	0
6	They have a cell membrane to control what comes in and out.They try to capture food.They remove things they don't need.	15360	0	0
6	anaphase, telophase, prosphase	15361	0	0
6	ITMBLOCKS SUBSTANCES FROM ENTERING OR LEAVING THE CELL MEMBRANE	15362	0	0
6	The cell necluous sends information to the other cells to move the whole organism.	15363	0	0
6	Cell wall, it helps keep the substance in the membrane,	15365	0	0
6	The three processes used by cells to control the movement of substances across the cell membrane are DNA movement, respiration, and food gathering.	15381	0	0
6	DiffusionActive transportPassive transport	15385	0	0
6	active transport    osmosisdiffusion	15388	0	0
6	the cell membrane is selectively permiable, and lets some supstances in but not others.  in plant cells the cell wall keeps things out of the cell.  Osmosis allows water to go into and out of the cell.	15392	2	2
6	osmosis- movement of water through the cell mambranediffusion- materials entering the cell though the membraneexocytosis- releasing of waste though the membrane	15401	1	1
6	they have movements that help the cell produce enought energy to move.the cells must have an energy source that will allow them to move and have a normal cell growth.while things are going past the cell membrane they have to watch for certain thigs that will allow the mto keep them safe.	15407	0	0
6	PHOTOSYNTHESIS, ACTIVE TRANSPORT,	15422	0	0
6	reproduction	15427	0	0
6	Selective permiability, it only allows certain things to move in and out of the cell.Homeostasis, it regulates the water balance in the cells so the cell can have an isotonic solution.	15433	1	1
6	Oragnelles, Flagella, cillia	15448	0	0
6	cydokenesisendoparticulum movment	15449	0	0
6	Three process used by cells to control the movement of substances across the cell membrane are	15452	0	0
6	1. DIFFUSION 2.3.	15463	0	0
6	Three processes used by cells to control the movement of substances across the cell membrane are mRNA rRNA and tRNA.	15473	0	0
6	Facilitated diffusion- is a way that substances move from one form of concentration to another form of consintration, diffusion- it takes substances from an area of high concentration to low consintraion, osmosis- deals with the water bieng moved	15480	3	3
6	Osmosis- The diffusion of materials through water particlesActive transport- Moves materials by using energyPassive transport- Moves materials without using energy	15486	2	2
6	Transcription.	15487	0	0
6	the size of the holes in the membrane. the flow of cytoplasm. the size of the substance trying to move through the organism.	15497	0	0
6	Translation, Transcription,	15498	0	0
6	transportation is where the cell transports proteins and sugars. transcription is where the cell rads what kind of protein or sugar its dealing with. Transformation is when they transform into bigger cells.	15500	0	0
6	The cell can use what is called cellular respiration, or it could use where the substances move across the top of the membrane in a gel like substance.	15505	0	0
6	1.) Diffusion: the movement of substances from an area of higher concentration into an area of lower concentration2.)Endocytosis: process by which materials are moved into the cell3.)Exocytosis: process by wich materials are moved out of the cell.	15508	1	1
6	Photosynthesis- where the plant uses the suns energy to get their foodCellular Respiration- where the plant uses the rain and human nature to live	15514	0	0
6	Three types of processes used by cells to control the movement of substances are Osmosis.	15534	0	0
6	1.  Mitosis2. Meosis3. ?	15550	0	0
6	Active transport(uses energy), facillitated diffusion(doesn't use energy), and a process where the cell opens up a saclike structure and engulfs he substance using energy)	15554	2	2
6	reprodution                    cytokenisiscelluar respitory	15560	0	0
6	endocytosis- process by which materials move into the cell.exocytosis-process by which matrials move out of the cell.solute pumping-	15564	0	0
6	One of the three processes is deleation, deleation is where it takes one of the cells away. The second of the three is replication, that is where one of the cells are replicated. The last process is called translation, translation is where you take one thing from another cell and add it to the existing cell.	15567	0	0
6	Cilia- Hair like structures that cover the organism, the friction of the hairs moving allows the organism to moveFlagellum- A long whip like structure is wiggled and the organism moves.	15592	0	0
6	One way to control the movement of substances arcoss the membrane is the stomata. This controls how much materials go into and out of the cell by opening and closing. Another way to control the movement is by diffusion. Some water goes into the cell while other go away. cellular respiration also helps the movment of substances.	15597	0	0
6	Three processes used by cells to control the movement of substances across the cell membrane are reprodution which is making new cells, transcription, which sends messages and translation which spells out what the message was pretty much.	15605	0	0
6	Cells use there selective membranes to decide what goes in and out of a cell.Cells use active transport which is moving things acrosss the concentration granite.Cells use passive transport which moves things with the concentration granite.	15618	3	2
6	RECEPTER ROTIENCE ONLY LET SERIAN THING THROUGH, CHANNEL PROTIENCE LET THINGS THROUGH THER CELL WALL. SMALLER THINGS CAN ALOS GO THROUGH THE WALL	15620	0	0
6	Active transport-requires energyPassive transport- requires no energyosmosis- the movement of water from one place to another	15627	3	3
6	the cell membrane sends the a message to another part of the cell membrane. then it sends the substances threw tubes.	15637	0	0
6	cell membrane cell wall and cytoplasm	15641	0	0
6	osmosis, diffusion, mitosis	15646	0	0
6	translationreproductionreflection	15650	0	0
6	The 3 processes cells use to controll movement would be, the physoplic biolayer which knows what goes in and out of the cell, then phosphates send the message about the movement and then the orgenelles inside move from one place to another.	15664	0	0
6	Endocytosis (which is part of active transport), where the cell uses energy to pull items through the selectively permeable membrane.Exocytosis (part of active transport), the cell uses energy to push items out of the cell.Diffusion (part of passive transport), the cell does not use energy to gain the items it wants but lets the items move through the selectively permeable membrane.	15667	0	0
6	There are certain cell organelles that controll what goes in and out of the cell. Also substances are moved in and out of the cell by diffusion. Another way is cells are able to controll how much of sometimes goes in or out of the cell	15694	0	0
6	One process the cell uses to move substances across the membrane, is through the nucleus. The Nucleus of a cell contains genetic material called DNA which tells the cell which processes to do, this process includes movement across the cell.  Secondly, The cell membrane in general is a regulator of what can and cannot enter and exit the cell.  Last of all, in the process of transfering DNA to other parts of the cell, mRNA moves across the cell to ribosomes, in order for the DNA to be processed and used for a specific cause. This example is a more specific way that shows how cells control movement within the membrane.	15708	0	0
6	The cellular membrane stops unwanted materials from getting into the cell. The nucleus decides what it wants inside of the cell.The cytoplasm slows untwanted materials so they can be killed.	15715	0	0
6	OSMISOSDIFFUSION	15753	0	0
