QuestionId	Answer	AnswerId	Score1	Score2
5	Translation- The amino acid code is translatedTranscription- The amino acid code is readSynthesis-The protein is made Introduction- The code is given	10974	0	0
5	1. The mRNA leaves the nucleus.2. The mRNA transports to the reticulum.3. The mRNA hooks onto a DNA.4. The mRNA is transported by the tRNA back to the nucleus,	10979	1	1
5	The mRNA is copied and the coped strand is taken to the	11004	0	0
5	mRNA leaves the nuleus and carries instructions for amino acid sequence of a protien to the ribosomes where it helps code the amino acid and makes the protien.	11006	1	1
5	sugarcarbondyoxides	11009	0	0
5	mRNA, diffusion, energy, sunlight, protein leaving the cell.	11010	0	0
5	1. leaving2. spreading in body3. attending to your body4. supplies minerals to body	11011	0	0
5	prophase metaphase anaphase telephase	11016	0	0
5	leaves the nucleus, goes to the golgi apparatus, then gets made into a protein, then leaves through the cell wall.	11029	0	0
5	the mRNA leaves the nucleus and travels to the ribosomes.Ribosomes make the poteins needed and sends them off to the mitochondria to send around the cell.	11036	1	1
5	When the mRNA leaves the nucles it travels to the mitochondria to code for the proteins that need to be made.	11043	0	0
5	it may be that Dna is going to take place	11053	0	0
5	The nucleuas sends out the mRNA to the ER and then it goes to the rRna and tells the ribosomes what to do. After that then it goes to tRNA and the proteins are produced.	11060	1	1
5	1-Looses the nucleus	11081	0	0
5	1) The mRNA attaches to a ribosome because protein synthiesis takes place in the ribosome.2) Corresponding tRNA attaches to the mRNA where the nitrogenous bases match up.3) These nitrogenous bases code for an amino acid.4) A protein is formed by a strain of amino acids joined by petide bonds.	11083	2	2
5	it has to change to tRNA then it has to find the amino acids. and then it has to come up with the right proteins.	11084	0	0
5	After mRNA leaves with information, it then takes it to tRNA. After this is done tRNA is helping produce atp for protiens. After this process is done rRNA comes in. RRNA is later fixing together the protiens.	11088	0	0
5	THE 4 STEPS ARE TO FIRST GET THE NUTRIENTS OUT. THEN SECONDLY GET THE PROTIEN OUT OF IT. THEN START TO MOVE IT THREW THE CELL. THEN GET RID OF IT.	11121	0	0
5	Step 1. mRNA has to be changed into rRNA.Step 2. One of the strands have to leave and another hooks on.Step 3. The strand binds together.Step 4. The strand goes to do its work.	11152	0	0
5	they 'unzip'they copy the informationthey 're-zip' they have now made two copies of the information	11158	0	0
5	mRNA tranfers like a messenger to tRNA	11163	0	0
5	mRNA leaves the nucleus; proteins are brought to the golgi body; golgi body sends the proteins to the endoplasmic reticulum; ER synthesises the proteins	11168	0	0
5	First the protein is made, then it forms.  After it forms then it starts to make the protein.  At last it is fully functional.	11177	0	0
5	tRNA- carries instructions from nucleus.gRNA- follows the instructions.rRNA- goes back to the nucleus.	11178	0	0
5	for this process the mRNA switches over                                    now it becomes  tRNA                                                               which carries instuctions from the nucleus to the amino acid sequence of protein	11186	0	0
5	sugursoxygenproductsenergy	11198	0	0
5	Starting with the mRNA leaving the nucleus, afterwards, the messenger RNA will then go back to the DNA to give the new strand's copied information. The DNA will then copy the information then re create a new strand for the messenger RNA to take back to the nucleus and bring back a new strand of copied information.	11205	0	0
5	1. The first step is when the mRNA releases from the nucleus into the cytoplasm.2. Next the cytoplasm that has the mRNA in it will attach to a ribosome.3. That ribosome will soon make a peptide bond between the first and second amino acid.4. This will continue until it reaches a stop codon.	11208	2	2
5	DNA,RNA, TRANSLAION, tRNA,PROTEIN,	11230	0	0
5	The mRNA is the messenger so it sends the message to other parts of the cell. Then transcription occurs, then tRNA occurs and this is where it carries instructions from the nucleus to the amino acid sequence of a protein.	11233	0	0
5	Protein synthesis has four major steps which are the mRNA leaves the nucleus then makes the protein into a smaller strand and the tRNA takes it to where the RNA is and passes it off to the RNA, then the RNA takes the protein to where they can read it.	11252	0	0
5	1.tRNA takes the message to the codons to form a new strand2.The new strand is made by the tRNA getting codes from the DNA3.The codons then are matched up and the new protein is one long strand4.It is then put in a chamber where it is folded to the shape it needs to be in to carry out its function	11258	0	0
5	mRNA leaves the nucleus and travels to the ribosome where an adhesive is placed on it. It then travels to the golgi apparatus where it is added to a corresponding strand of RNA to make DNA. The DNA is used for reproduction.	11268	1	1
5	The proteins enter the body.The proteins go into teh cells.The proteins are use by teh cells.The energy from teh proteins is used throughout teh body.	11301	0	0
5	The mRNA leaves, and transfers into tRNA (because mRNA is the messenger RNA). the tRNA holds the information.	11307	0	0
5	aau,aaa,tau,uuu	11311	0	0
5	ExitingTravelingArrivingReturning	11314	0	0
5	When mRNA leaves the nucleus it enters the cytoplasm which attaches to the Amino Acid chain, which goes to the ribosomes and make  proteins(Amino Acids).	11349	0	0
5	The next step after the mRNA is the tRNA and that is the transer DNA. That holds the message that the DNA gave the mRNA. After that is when the membrane get the information. After that is when the body responds to that.	11354	0	0
5	RNA-DNA- Protein-trait	11378	0	0
5	the nuclius,the memebrans and organells	11384	0	0
5	cell mebrane	11395	0	0
5	The mRNA goes to the ribsosomes.The Ribsosomes make a templet.tRNA finds the parts to make the protiensmRNA goes with the ribsosomes to make the protiens	11406	1	1
5	Interfase is the longest phase in the cycle. After interfase is prophase which is the first stade of meiosis. The second stage is anaphase which the nucleus splits in two. The last stage is metaphase. Then you have a new cell.	11417	0	0
5	First, mRNA goes to the lysosomes.Second, it copies into tRNA.Third, the tRNA gets codons.Finally, the codons form proteins.	11418	0	0
5	1. The mRna tells the Trna to get ready at the ribosome2. The Trna goes and attaches the pairs together3. They keep attaching until it hits stop codon4. The protein is released	11434	1	1
5	The mRNA that was copied from the DNA leaves the nucleus. It goes to the ribosome, where it is transcripted. Each codon codes for an amino acid. The proteins are linked together as they are translated.	11441	1	1
5	Protein synthesis consists of the building of amino acids. Then they link together forming a chain.Next the chains attach together.Lastly, they turn into the new RNA.	11450	1	0
5	Well you have the stop codon, then... I dont know the rest	11451	0	0
5	energystores foodprotects the cell and foodhelps it stay alive	11460	0	0
5	The mRNA goes through the nuclear pores and delivers the message. The message is then processed and the cells completes the task.	11491	1	1
5	Messenger RNA collects the information it needs to copy DNA, then tRNA changes Thymine to Uracil. Two strands of RNA are made.	11497	0	0
5	prophase metaphaseanaphasetelaphase	11500	0	0
5	Anaphase, Interphase,Metaphase,Prophase	11502	0	0
5	the mRNA is copied and then sent out by the ribosomes. then goes through the endoplasmic reticioulm where it does its job.	11513	1	1
5	translation transcription conversion	11517	0	0
5	the strand of DNA unzips and the mRNA fills in one of the sides of the DNA once the whole strand has been remade the mRNA goes to other cells in the body contain that needed information.	11519	0	0
5	Mitochondria,	11521	0	0
5	It first goes through mRNA and attaches on the the mRNA and waits for something to come then it drops off and it goes on to another strand of mRNA	11538	0	0
5	The RNA leaves the nucleus and then sends codes to the DNA telling it what its new match will be, switching the A's to U's. T's go with A's G's with C's and visversa except the A will switch to a U instead of a T. This is known as mRNA. Then the mRNA sends codes to the proteins telling what codon it will be.example:DNA: ATGTACCGTATGACTmRNA: UAC-AUG-GCA-UAC-UGA(after RNA happens)Amino acid: Tyr, Met (technically you start with a Met), Ala, Tyr, STOP	11558	1	1
5	First the mRNA is sent from the nucleus and sent to the ribosomes. Than it is changed into tRNA. After it is turned into tRNA it is sent to be turned into protein. Than when it is turned into a protein it is sent into the body to do it's job.	11566	1	1
5	The mRNA leaves the nucleus.It then is tRNA and is carried to where it will create the new cell.The mRNA is transcribed.The mRNA is now a new strand of RNA.	11569	0	0
5	The mRNA carries the instructions from the nucleus to the outside of the cell, then to the tRNA, the tRNA carries the instructions to the proteins for synthesis.	11578	0	0
5	Protein Synthesis:    1. codon changes    2. reaction happens    3. new messanger    4. tRNA	11581	0	0
5	Four major steps involed in portein synthesis are trascription when the strand od dna gets ripped apart then traslation when things occur in the nucleus.	11584	0	0
5	mRNA has to leave the nucleus, then it transfers information to tRNA. After it does that it makes copies, then lastly sends it back to mRNA.	11586	0	0
5	When mRNA leaves the nucleus it transfers to tRNA. Then it makes amino acids. Then the amino acids make a peptide bond, Then the cycle repeats.	11594	1	1
5	The mRNA moves out of the nucleus. It is then moved to the cell membrane. Then it is copied down. Last the information acts like a blueprint as the thing needed is built.	11597	0	0
5	1. water2. sun	11605	0	0
5	1. the mRNA goes out of the nucleus and to the tRNA2. Then the tRNA translates the RNA and creates aminp acids to go along with the RNA.3. They attach together.4. and they start making proteins	11613	0	0
5	transfers to tRNAmakes an amino acid sequencedecodes the amino acid sequencesends it to the	11629	0	0
5	mRNA leaves the nucleus and enters the cytoplasm. When traveling the cytoplasm it connects to a ribosome. The ribosomes reads off the mRNA as a codon(three at a time)each codon coding for a amino acid. tRNA travels along the mRNA and carries anti-codons to connect with the codons. The codons and anti-codons are then connected making a strand of protein.	11639	2	1
5	1.) Mrna leaves 2.) tna	11652	0	0
5	1.the cell opens2. RNA comes out3.then the cell releases the glucose4.then the glucose goes back into a different cell.the cell opens and the rna comes out and then the cell releases the glucose out into the cytoplasm and then the glucose goes into a different cell.	11669	0	0
5	The process of protien synthesis invovles four steps, including phase 1,meiosis, phase 2, and mitosis.  This causes many changes within the cell.	11677	0	0
5	the mRNA is taken to the cytoplasmthe tRNA helps to create the new protien	11678	0	0
5	wellll, i think the first one might be meiosis or Mitosisbut i really don`t have any idea so i`m just taking a wild guess so i don`t get this question wrong(:kthanks for the poinnts	11700	0	0
5	Protein is distributed through the ribosomes and stored through out the cell after the mRNA tells it what to do.	11714	0	0
5	protein gos into the blood and around the body. it helps to keep muscles storng.	11717	0	0
5	1. First the nucleus would go through Metaphase.     2. Second the nucleus would go through Anaphase.3. Third the nucleus would go through Telophase.4. Last the nucleus would go through Cytokenisis.	11734	0	0
5	1. It turms into tRNA and travels to the ribosome.2. It picks up surrounding amino acids and takes them to the ribosome.3. It forms rRNA and begins binding the amino acids in the ribosome.4.  It then forms a new strand of RNA.	11736	0	0
5	RnarRnatRnagRna	11749	0	0
5	It enters. It grows. It breaks down. It leaves.	11750	0	0
5	tRNA carries instruction from nucleus for amino acid sequence of a protein.	11751	0	0
5	it has the protiens which are being transfered to the DNA stran so it can join togethr then break off to make an entirely new DNA strand.	11800	0	0
5	MRNA as a polymer is involved in protein synthesis. THey are making the proteins snythesis with each other.Step 1: To arrive where the proteins are2: brake the proteins up3: conncet proteins again with Rna 4: the process is complete	11822	0	0
5	first they leave the body, then copy themselves, then transfer, last they make a new strand	11836	0	0
5	First the mRNA leaves the nucleus after it got transcribed from half of a strand of DNA. The small and large ribosomes then attach to the RNA to translate it. The codons get translated to an amino acid, and the small and large ribosomes pull the needed amino acid over and go to the next codon. They do this until they have a long strand of amino acids to make a protein.	11839	1	2
5	One step is microevolution.	11842	0	0
5	1. the DNA turns into mRNA.2.then the mRNA turns into tRNA3.the cycle happens over again	11852	0	0
5	it leaves the nucleus and helps the cell find protiens for the cell and help it survive and make it healthy.	11867	0	0
5	The mRNA leaves the nucleus.The mRNA goes to the tRNA and transcribes its information.The tRNA goes to a ribosome.The tRNA translates onto the rRNA and begins making proteins.	11878	0	0
5	prophase,metaphase,anaphase and interphase	11888	0	0
5	LEAVES NUCLEUS, ENTERS BODY, DELIVERS MESSAGES ABOUT AMINO ACID SEQUENCE, HEADS BACK TO NUCLEUS	11899	0	0
5	prophase, metaphase, anaphase, telaphase	11919	0	0
5	1. mRNA leaves the nucleus2. Two nuclei come together3. Then they go apart4. Finally they become more powerful	11923	0	0
5	After mRNA has left the nucleus, it floats around until it finds a matching strand.  After it has found its matching strand, the two strands line up and then connect to each other creating a protein.	11927	0	0
5	mrna leaves the nucles, the rna carries instructions from the nucleus, the ribosomes use the instructions, the ribosomes make proteins	11937	0	1
5	Starting with mRNA, it leaves the nucleus, then it sends its instructions for the amino acid sequence of a protein. It returns back as tRNA. It transfers the protein to the nucleus.	11938	0	0
5	The mRNA leaves the nucleus and docks into a ribosome. Then, tRNA that fits comes and attaches to the mRNA. The tRNA then builds up into Amino Acids that link together to become a protein.	11940	2	2
5	In protein synthesis, after the mRNA leaves the nucleus, it carries the instructions to the cytooplasm.  It then enters a ribosome and prepares to be copied.  Transfer RNA brings the codons attached to the amino acid to the ribosome. It attaches at the first bonding site which  matches the complementary codons. THe tRNA the moves on the the next bonding site where it releases the amino acid which attaches to the amino acid on the tRNA behind it.  Once the mRNA reaches a stop codon, the amino acids detach and form a polypeptide bond.	11945	3	3
5	First the mRNA leaves the nucleus and locates in the cytoplasm at the ribosomes. Once it was relocated to the ribosomes it is transfered into rRNA and then read by the tRNA. Once the tRNA reads the information amino acids are produced and they are the building blocks of proteins.	11967	1	1
5	1. The mRNA arives at the ribazones.2. The ribazones decode the mRNA.3. The ribazones use the decoded mRNA to mek proteins.4. The proteins are used for energy in the cell.	11978	1	1
5	Prophase is where the parts of the cell move. Anaphase is where they break out of the nucleus. Metaphase is where the parts of the cell line up in the middle. Telaphase is where the cell divides.	11983	0	0
5	4 steps involved in protein synthesis is mRNA is moving into the cytoplams, then it binds with the rRNA in ribosome, then tRNA binds its anticodon to the codon of the mRNA, then translation occurs and polypeptide chains of amino acids are formed.	11984	3	2
5	transationtranscriptionsegregationformation of a protein	11994	0	0
5	The major part is amino acids being apart of it and helping us have what we need to survive.	12004	0	0
5	The Double helix of DNA splits up and makes one strand of RNA.	12014	0	0
5	1. mRNA seperates from DNA and leaves the nucleus2. The mRNA gives information for making protein3. Codon signals start to make amino acids for proteins4. Sequence hits a stop codon and the protein is released into the cell	12016	1	1
5	The mRNA goes to the ribosomes to deliver the genetic code from the nucleus.  The ribsomes connect the nucleic acids and send it to the Golgi Apparatus.  Then the Gogli aparatus gets rid of the bad proteins.  Then gets the good proteins ready to be used in the cell.	12020	1	1
5	anaphaseprophasetelephasemetaphase	12027	0	0
5	The mRNA sends off the code to the mitochondria	12030	0	0
5	1.the mRNA will have to be translated after it leaves the nucleus.2. When the strand is translated tRNA will add anticodons to it.3. tRNA will carry amino acids with it to bind to the strand. 4. the amino acids will bind creating a protein.	12032	2	2
5	The four major steps are prophase, metaphase, anaphase, and telophase.	12039	0	0
5	mRNA copies it's self with DNA to make a codon strand mRNA sends information to the tRNA the tRNA then translates the codons the rRNA produces proteins	12048	1	1
5	mRNA takes proteins to rRNAsends copies to tRNAdepulicates	12059	0	0
5	mRNA tells the body the of the need for protein.The body responds to the message and starts the protein synthesis cycle.The Body then makes the needed protein.	12068	0	0
5	IT GOES TO tRNA WHICH TAKES IT TO THE MITOCHONDIRA WHERE IT IS TRANSFORMED INTO RNA	12073	0	0
5	Your ribosomes would store energy and food. It would store enough for them to require enough energy to make protines. First they would gather energy from the organelles and then use RNA to create the protines.	12088	0	0
5	The mRNA leaves the nucleus an then goes to the tRNA where it transfers the information, then it goes to the rRNA.	12094	0	0
5	1) mRNA leaves the nucleus.2) mRNA travels into the cytoplasm 3) mRNA is translated into tRNA 4)tRNA makes another strand to make another cell.	12096	1	0
5	tRNA-transportig it through ribosome.rRNA- helping it through. Making protiens and transporting them away.	12102	0	0
5	mRNA leaves the nucleus, goes to the place where the protein arrives, then goes to the place where proteins gets stored, after that they return to the nucleus and starts all over the next min and does it again.	12112	0	0
5	1.  The mRNA leaves the nucleus because the DNA is to big to fit through the nucleaus pores.2.  The mRNA then separates from the DNA side.3.  A new strand of DNA fills in on the old DNA side.4. A new complete strand of DNA is formed	12118	1	1
5	Umm...Copy the strand of RNA .Use bonds the connect the corrasponding nucleotides together.(no clue!)The process starts all over again.	12120	0	0
5	1-the mRNA travels to a ribosome 2-The codons on the mRNA signal for an amino acid3-Translation-tRNA match up an amino acid to each codon on the mRNA starting with the start codon4-termination-the amino acids are matched up with the codons on the mRNA until the stop codon is reached, which signals the end of translation	12123	3	3
5	mRNA occurs transfering over to tRNA, while entering the nucleus and dividing into it's own parts of RNA.	12133	0	0
5	Its tells what protiens  to make and it makes it	12134	0	0
5	the four major steps to involved in protein synthesis are	12135	0	0
5	1. A ribosome attaches to the mRNA (rRNA). Translation Occurs;2. Codons are coded for a specific amino acid.3. Anticodons that are in the tRNA are paired with the codons in the mRNA. 4. Peptide bonds are formed between the amino acids after translation has occured. New proteins are made.	12144	3	3
5	mRNA leaves the nucleus.  Next it goes into the golgi aparatus.  Then it starts making amino acids.  After that the ribosomes start making the protein.	12146	0	0
5	1. Translation. goes to the tRNA tells it what it needs.2. RNA processing3. The tRNA combines the protien to copy the mRNA brought out of the nuecleous with hydrogen bonds.4. the rRNA takes it out of the cell and places it where it is needed.	12159	0	0
5	When mRNA leaves the nucleus, the four major steps involved in protein synthisis are spliting, copying, forming a new strand, and putting it all back together.	12195	0	0
5	it first starts out when something needs repaired then thats when the dna sends signals to start a recreation of something the body need's so what happens is that MRNA comes into effect then thats when dna creates MRNA that's when MRNA goes to what needs to be fixed and gives it protien to do so. And MRNA is small enough to fit threw the holes thats in a nucleus	12219	0	0
5	mRNA takes protein to DNA strand coping it and making new	12222	0	0
5	The four major steps in protein synthesis are prophase, metaphase, anaphase, telophase.	12238	0	0
5	mrna messages the trna of the new protein, which then transports the protein through the kaleb cycles to be built for a specified reason	12242	0	0
5	tRNA matches its anticodons with mRNA codons. tRNA gets the corresponding amino acid. Then brings the acid back to the corresponding mRNA.	12256	1	1
5	First, it takes the instructions from the nucleus for a sequence of amino acid.Second, it brings them back to the ribosomes and starts protein synthesisThird, the ribosomes start to synthesize protein using the instructions.Fourth, they release the proteins after synthesizing them.	12261	1	0
5	There's translation, and transcription.	12274	0	0
5	1. the protein gets carried to the necleus2. there the protein gets copied3. New dna is formed4. the protein is used for engergy	12278	0	0
5	prophase, metaphase, telophase, anaphase	12280	0	0
5	One step is that the cells in mRNA are copied.Another step is once the mRNA leaves the nucleus it turns to RNA.A third step is the RNA changes its sugar to Ribose.	12282	0	0
5	FIRST THE mRNA HAS TO TRAVEL TO THE OTHER END OF THE BODY. THEN IT HAS TO FIGHT OFF THE EVIL SPACE INVADERS FROM THE PLANET CORTEX. AFTER THAT IS DONE IT GOES BACK TO IT'S APARTMENT I THE VRAIN AND CALCULATES HOW LONG IT WILL TAKE TO SPLIT A PROTEIN IN HALF. THEN THERE IS A NINJA FIGHT SCENE BETWEEN THE mRNA AND A PROTEIN WHICH ENDS BY THE mRNA KARATE CHOPPING THE PROTEIN IN HALF AND THAT IS HOW PROTEIN SYNTHESIS IS DONE.	12284	0	0
5	The four major steps involved in protein synthesis are the stages of mitosis. Prophase, Metaphase, Anaphase, and Telophase.In the process of mitosis, the cell parts work together to move to the edges of the cell, pull apart, divide, and start all over as daughter cells.	12294	0	0
5	after it gives its message it will gointo the body	12306	0	0
5	1. mRNA leaves the cell2. The ribazome reads each segment    3. As the segments are read amino acids coding for each segment come down to the ribazome4. The amino acids attach to each other to form a protein	12317	1	1
5	As mRNA leaves the nucleus, it sends it to the tRNA to get transfered onto the RNA sequence and be seperated into codons and read into amino acids. The rRNA does the reading and after it is read, sends these codes of sequences into a polypeptide chain to then be transfered back into the DNA sequence.	12326	1	1
5	mRNA leases the nucleus and signals certain pathways which then signal for cerain ribosomes to release and help synthesize proteins. rRNA then codes for tRNA to transfers certain ribosomes to the receptors for the creation of proteins.	12330	0	0
5	The four major steps are one they find the main good cells that are good to reproduce other good cells. Second they go into anapahase to make the process of making proteins faster. Third is that when they are done with anaphase they go inside of each others cells and start making proteins inside them. Fourth is that the protein comes out and there is a good protein that just got made.	12350	0	0
5	The four major steps are the mRNA traveling around, the other organelles will work together, they will then try to do something that helps the cell, and then the protein will synthesize.	12363	0	0
5	After the mRNA leaves it goes to the ribosome and the tRNA brings amino acids to the mRNA.	12366	1	1
5	The creation, developing the protein, and sending it out of the nucleus	12371	0	0
5	When the mRNA leaves the nucleus it goes through two cells. Then the tRNA comes and make matches with the floting letters. From there the amino acids are created and they make a peptide bond and the strand goes away to become DNA.	12392	0	0
5	1: The mRNA send information to the rRNA to tell it to make amino acids.2: The rRNA makes the amino acids.3: The amino acids are then made into RNA by tRNA4: Then the DNA and RNA com together.	12405	0	0
5	mRNA leaves the nucleus to collect data and brings it back into the cell. After that, the DNA is replicated. Following this step, the tRNA transfers the DNA onto the replication. Ribosomes hold the replica into place as it transfers.	12413	0	0
5	MESSANGER RNA TO ENDOPLACIUM RETICULUM TO RIBOSOMES THEN ATTACHES TO WALL	12423	1	1
5	copy and moltuply to make more Rna or Dna	12452	0	0
5	mRNA leaves the nucleus, then your protein comes in. After that your cells divide and then they go to yuor membrane.	12453	0	0
