QuestionId	Answer	AnswerId	Score1	Score2
5	1. Reproduction2. Crossing-over3.Replication4. Becoming a new cell	12434	0	0
5	Four major steps are crossing over, movement, mitosis, and meiosis.	12435	0	0
5	One step is mRNA being remembered.Second step is the proteins being made.Third step is the proteins being released.Fourth Step is the proteins being used as energy.	12442	0	0
5	Four major steps involved in protein synthesis is	12448	0	0
5	starting with mrna, it reads the bonds like instructions, then sends this to the nuclesous to get transfered into the second strain. After that it is transfered to the RNA strain, which is turned into the last form. Then is Hocked to the hydroxide bonds.	12464	0	0
5	The mRNA then goes to the ribosomes.  From the ribosomes it goes to the ER.  Then the ER takes it to the cell membrane and then it goes throught the cell membrane out into the body.	12476	1	1
5	The first step is that the protien unzips the mRNA. The next step is that it takes out any kind of trash that it may have. Next the protien comes back and Zips it back up. The last step is that it sends it back from the nucleus to the cytoplasm.	12479	0	0
5	it leaves the nucleus and then goes trhough the ionic channels	12489	0	0
5	1. The mRNA goes to a ribosome where protein synthesis will occur.2. The mRNA is read to produce anticodons.3. tRNA brings the anticodons to the ribosome. Each codon codes for a specific amino acid.4. The codons go together to form a polypeptide chain(the protein).	12495	1	1
5	four major steps that are involved with protein sythesis are prophase, metaphase,interphase,and annaphase.	12502	0	0
5	metaphseprophaseanaphasetelephase	12517	0	0
5	The mRNA tells some other RNA to make some protein.  So that RNA goes somewhere else.  Then at that place it makes some protein.  The protein leaves when it is made.	12523	0	0
5	ReplicationTranscriptionTranslationDNA	12526	0	0
5	The mRNA starts by making a copy of itself, then is sends if to the tRNA where it is transported throughout the body. Then the rRNA remembers the sequence, and sends it to the DNA.	12533	0	0
5	mRNA goes to the DNA and then travels to the ribose	12536	0	0
5	'Helping maintain synthesis'Making sure proteins are are leaving the nucleus at a resonable time.'Clearing any unnescary findings before the process.'Notififying the nucleus.	12537	0	0
5	tRNA transfers cells mRNA messangerrRNAgRNA	12542	0	0
5	Protein leaves the nuclues. It gets synthesized. It goes back to nucleus. The nucleus responds and uses it.	12558	0	0
5	mRNAtRNArRNARNA	12564	0	0
5	1. The mRNA goes into the cytoplasm and finds a ribosmome .2. The mRNA has the code and the tRNA gets this code, and finds the amino acid that matches this code. 3. The rRNA acts as a holding device while this is going on. 4. The tRNA brings back the amino acid to the ribosome where the protein is made because amino acids are the monomer of proteins.	12565	2	2
5	1. the mRNA leavcs the nucleus2. It goes to the tRNA and reproduces3. From the reproduction there are more cells now4. the cells attaches on to another strand and starts the cycle again.	12578	0	0
5	After leaving the nucleus the mRNA goes to the tRNA and is decoded and an amino acid is made from each codon. Then the amino acids connect to make a protein stand.	12579	1	1
5	ENTER  EXIT  RIBOMSOME AND, ENZMES	12589	0	0
5	mitosis cell division	12590	0	0
5	mRNA transfers the sequences of amino acids to tRNA.  From tRNA it is translated back to DNA for a new protein to be created.  At this point the daughter DNA sequence is sent to the golgi apparatus where it is 'packaged' and sent out to perform it's assigned function.	12609	0	0
5	1.)you eat the protein so u can get strong.2.)it helps you grow strongh bones so when you get older you can lift heavy objects.3.)it helps fight of disease.4.)it makes you less likely to get sick	12626	0	0
5	anaphase, metaphase, prophase, and telaphase	12627	0	0
5	GuanineThymineCitosoneAdnine	12647	0	0
5	mRNA takes it to tRNA which then takes it to the the rRNA that reads it and decodes it to get the message.	12648	0	0
5	After the mRNA leaves the nucleus, it goes to the ribosomes to leave the cell. Once the ribosomes leave the cell through the cell membrane that is dissappearing, it goes and attaches itself to the codon strand. Once at the strand, it copies the data that will then be sent to get the anticodon strand to match up and make a protein.	12650	1	1
5	The mRNA leaves the nucleus and goes to the ribosomes and turns into tRNA and that goes and makes a polypeptide chain which is also known as an amino acid and the amino acids put together make proteins.	12664	1	1
5	1) mRNA leaves the nucleus 2) it gets changed in RNA 3) RNA is 'coded' into an amino acid sequence and converts to DNA 4) protein synthesis	12674	0	0
5	1. The mRNA is sent to the tRNA to make the amino acids.2. The data on the mRNA is transfered to tRNA.3. The tRNA is then sent to the rRNA to make the RNA     sequence.4. The amino acids are then connected to one another by peptide     bonds.	12675	1	1
5	The mRNA leaves the nucleus through a small hole, only sizable for it. It then goes to the ribosome. Once its in, the tRNA begings to match it up with the opposite letters in pairs of three. The strand leaves the ribosome in pairs of three, the amino acid sequence to make the protiens we need.	12679	2	2
5	The nucleus makes a strand of RNAThe RNA goes to the ribosomes to tell it to make protien.The message in the RNA is seen by the ribosomes.The ribosmomes makes the protien.	12683	0	0
5	The tRNA is broken down into genetic code so that other RNA strands can read it and react to it.	12692	0	0
5	preparedsynthesizingsythensizedenergy usage	12728	0	0
5	mRna leaves the nucleus, and enters the cytoplasm. From there, it attaches to a ribosome. Then it finds the correct tRna molecule to attach to and it bonds to this tRNA molecule by a peptide bond.	12729	1	1
5	living in the envorment, to survle the envorment, to have a nuff to eat	12733	0	0
6	Cell Wall- controls what goes in and outCell Membrane- also controls what goes in and outNucleus- conrtols what the cell does	13976	0	0
6	Three processes used by cells to control the movement of substances across the cell membrane include: Keeping all the healthy cells healthy, getting rid of the bad cells, and maintaining a smooth environment.	13982	0	0
6	1. the cell can control the membrane cause its part of the cell2. the cell can control the membrane like we can do same to ours3.the cell sends a it threw littel tiny cells to the membrane	14000	0	0
6	Three processes used by cells to control the movement of substances across the cell membrane are Diffusion; paricles moving from high to low consentration. Osmises;	14006	1	1
6	cell wall which controls what goes in and out of the cell.nucleas is the brain of the cell/centermitochondria is the power house helps keep things moving	14040	0	0
6	MITOSIS , PROPHASE,AND METAPHASE	14066	0	0
6	Cells use osmosis, active transport, and facilitated transport to control the movement of substances across the cell membrane. Osmosis occurs when water and other materials move from an area of high concentration to an area of low concentration. Active transport occurs when materials are brought into and out of the cell using the cell's energy. Facilitated transport occurs when materials are brought into and out of the cell using a mixture of energy from the cell and energy from the products.	14069	2	2
6	Cell wall- only lets some stuff throughgolgi aparatus- controls waste	14078	0	0
6	tRNAmRNArRna	14079	0	0
6	they help them movethe are a celll in a membraneand they control the movement of substances.	14100	0	0
6	Flagellas is a tail that allows the cell to 'swim' around. Slime allows cells to move around. And little tenticles on outside of cell to help swim around.	14121	0	0
6	1.) They confront it to see if its a bad substance or a good one.2.) If its bad they willl destroy it.3.)If its a good substance it will adapt to it.	14130	0	0
6	Cells use passive transport through methods of diffusiion and osmosis, and also have the abilirty to use active transport with functions such as exo/endocytosis and sodium potassium pumps.	14139	0	0
6	The cell membrane can only let certain things in and out of the cells	14152	0	0
6	it pushes unwanted waste out	14155	0	0
6	Flagellum- a tail like structure used to 'swim' around.Cilia- hair-like structures that whip around providing movement.Another one is where the organism extends out sections of it's cell membrane and fills it with cytoplasm while the opposite end goes away and it moves by a crawling type movement.	14162	0	0
6	-Diffusion.     -Osmosis.	14168	0	0
6	1. Active transport is a process that requires energy because it moves substances against their concentration gradient.2. Simple diffusion is a type of passive transport that moves substances down their concentration gradient. This process requires no energy.3. Facilitated diffusion is a type of passive transport that uses protein to move substances across the cell membrane. No energy is required for this process.	14178	1	3
6	One process used by cells to contol movement is osmosis. Osmosis is the controlled amount of water that goes through the membrane of the cell. Another process is diffusion. Diffusion is the process by which substances move accross the membrane. This monitors the substances that go through the semi-permeable membrane. Only some substances can leave and only some may enter. The third process is the permeability of the cell. The cell is semi-permeable so it will only let in some of the substances that try to enter the cell.	14180	2	2
6	One process used by cells is energy that functions the cell membrane.The second process used by cells is the cell wall keeping the cell membrane protected.The third process used by cells is the nucleus control everything to keep the movement on track.	14190	0	0
6	The cell membrane moves substances near the nucleaus. As new cells form, the membrane starts to multiply as the cells do.	14207	0	0
6	One prcess is the use of the semi-permeable membrane which regulates what goes in and out of the cell. Another one is osmosis which regulates what water moleucles can go in and out of the cell. in plants their cell wall controls what can get into the cell membrane by acting as a barrier from outside organisms.	14208	2	2
6	1the flagellum2.	14209	0	0
6	They transfer the DNA. They store proteins. And collect enzymes. They do all of that so that the cell can function.	14213	0	0
6	1. The cell cycle	14225	0	0
6	the cells absorb it and carry it to where it has to go. the cell pushes it. the cell flows with it to make it go where it has to go	14233	0	0
6	The three processes used are TRNA, DNA, and flagellum to control the movement of substances through the cell membrane.	14239	0	0
6	1. the cells allows what goes into the membrane.2. the cells allow what goes out of the membrane.3. it controls how the membrane allows the cell to reproduce.	14242	0	0
6	1. There is the cell wall that only lets wanted materials pass.2. Then there is the cytoplasm that will capturesomething unwanted and get rid of it.3. Lastly there is the nuclear envelope that also only lets wanted materials get through so it helps protect the cell from harmfull things.	14276	0	0
6	Osmosis is the movement of water coming in or leaving the cell through the membrane. Diffusion is where the cell evens out the matter on the inside and outside of the cell.	14317	1	1
6	tRNAmRNArRNA	14318	0	0
6	FELGELUM	14332	0	0
6	The cell membrane controls the traffic from one side to another side of the membrane.	14333	0	0
6	Cells travel through the human body when they are needed. It only takes a matter of seconds for them to get to where they are needed. Example: if you got a scratch on ur knee the second its ripped open and there are diseases and bacteria trying to infect it. There are anti bodies and white blood cells are fighting it off.	14343	0	0
6	1.) they can go through 'doors' called channel protein2.) they can insert their 'key' proetin to unlock the cell membrane in order to pass through3.) they can be transported out of the cell by the organelles	14349	0	0
6	The three processes used by cells to control movement of substances across the cell membrane are reproduction, storing energy and movement.  In reproduction the cell produces offspring.  Storing energy requires the cell to become more active.  Movement requires the cell to adapt to different places in the cell.	14366	0	0
6	The three ways cells move things across their membraine is osmosis, active transport and passive transport. Osmosis is the diffusion of water accross a semi-permiable membrane and doesnt require any energy. Active transport is when molecules are getting diffused against the concentration gradient and passive transport is when molecules are diffused going with the concentration garadient	14367	3	3
6	1.they use long whipped like structures to move around2.the cells go and kill the bad things that dont need to be in our body 3.the cells go from place to place multiplying themselves and helping our body	14385	0	0
6	A cell consist of many parts to protect things from getting in. One part is the cell membrane. The cell membrane acts like an outer lining to protect the cell from harmful things getting in. The mitocodria, is another part. It carries out waste from the cell. The final part is the cell wall, found only in plants. This allowes a double protection feature to be sure things don't get in.	14386	0	0
6	DiffusionThe process by which water moves across the semi-permeable membrane.	14388	0	0
6	Though a small opening that only aloows certain thing to come in. The fact there is no cell wall. Pushing and using enegry to get though the cell membrane.	14409	0	0
6	Reproduction of the cell.	14415	0	0
6	anaphaseprophasetelophase	14423	0	0
6	transricptiontranslation	14451	0	0
6	Diffusion, which is the movement of particles from an area of higher conentration to an area of lower concentration.	14458	1	1
6	the cells nucules controlls the whole cell and every thing in it.	14462	0	0
6	One way is that the cell moves on its owe with the help of other cellsAnother way is that the cell carries what it can when it's needed to be carried out.Last way is the cell multiply's continuesly .	14466	0	0
6	They swim across. They wiggle. They crawl.	14474	0	0
6	Cells use processes to control the movement of substances across the cell membrane, these processes are respiration, cell division, and also reproduction.	14487	0	0
6	The cell membrane has three processes to control the movement of substances, one being that it protects the cell, allowing only what it wants to enter and exit.	14498	0	0
6	-Its nucleus sends out information to the cell membrane so it can preform functions.-Uses mitochondrion to give the cell membrane commands.- Uses proteins	14508	0	0
6	cells transport energy across the membrane.	14510	0	0
6	One process is osmosis. Another is diffusion. The last is transfusion,	14511	0	0
6	PHOTOSENTHISIS,	14515	0	0
6	endocrytosis- chooses what goes inexocytosis- choose what goes outselective permeabilty- chooses what goes in and out of the cell	14526	1	1
6	they use their tail for movement.proteinsnucleus	14537	0	0
6	One prosses of moving substances across a cell is Osmosis. This is when water masses through the cell membrane.	14538	1	1
6	one part opens and kinda suck it in and another part filters to keep the bad thing out and then the first part which is the cell membrane closes back up.	14541	0	0
6	The cell can use passive transport, which allows things to freely move in and out of the cell given the concentration of the matter. Active transport uses energy from the cell to move materials against the gradient. One form of this moves materials out, called endosymbiosis. Another form moves them inside the cell, called exosymbiosis.	14548	1	1
6	reproduction, cellular communication, cellular reproduction	14549	0	0
6	The nuclius is the brain of the cell that controls everything.  The vacuol takes all unessisary wast and bacteria out of the cell. The mitocondrian surve to maximize cellular reperation by increasing cellular communication.	14562	0	0
6	mitosis	14602	0	0
6	control the membrane control its movements	14603	0	0
6	Dynamic equilibrium: the cell membrane keeps the same amout of substances in a cell as there is out.Diffusion: the movement of water across the cell membrane.Semipermeable membrane: allows some substanes to enter and others to not enter the cell.	14617	1	1
6	The cell uses the Chloroplast to move things quickly and efficently.  They also use the cell wall to keep things in so they can't loose anything.  The membrane tells everything where it needs to be and where to go.	14626	0	0
6	Cell membrane controls what enters and leaves the cellribosomes make protein and send it where it needs to go the lysosomes control the waste of the cell and dispose of it	14645	0	0
6	Diffusion, selective permiabilty, and osmosis	14648	0	0
6	Molecules stop certain substances from getting accross, but sometimes the substances can sneak in when another substance in going in.	14651	0	0
6	-to keep there cell in the same shape.-to find food.-to keep diffrent bacteria out of people system.	14655	0	0
6	reproduction	14660	0	0
6	The three processes used by the cell are the making of proteins,the packing process,and the moving of the proteins out.	14662	0	0
6	Process one- nuclear envelope and pores allow things to travel in and out of the nucleus. Process two- Cell membrane protects the cell and also decides what can go in and out of the cell.Process three- osmosis	14675	0	0
6	THERE ANTIBODIES AND THERE ATOMS ALL WORK TOGETHER TO HELP THE CELL MOVE ALSO THE NEUCLIOUS FLOWS AROUND WICH GIVE THE CELL MOTION.	14694	0	0
6	production, energy,	14700	0	0
6	they move through the blood  stream into the membrane . and they repuduce . and become apart of the membrane	14713	0	0
6	Fertilization.Mutualism.Reproduction.	14714	0	0
6	There is transition, translation, and transcription.	14716	0	0
6	Plant cells have a cell wall that only protiens can penatrate.Other cells can tell wheither or not that the substance needs to be in the cell or not.	14728	0	0
6	Cell uses the mitchondria to produce energy for the cell. It uses the vacoule to store food and water for future times. Ribosomes use proteins for the cell.	14753	0	0
6	AnaphaseProphaseTelophase	14756	0	0
6	It uses small hair like structures to move around. They move back and forth across the membrane to move. then the substance can be moved any where on the cell.	14757	0	0
6	Homostasis	14768	0	0
6	Active Transport, Calvin Cycle, and Light Dependent Reactions.	14813	0	0
6	1. dna replication2. 3. protien synthesis	14818	0	0
6	The cell has osmosis, which means the substances move through the membrane surface, not across. It also has Diffusion, which is how it moves things across the surface of the membrane. It also has another thing, but i can't remember it.	14835	0	0
6	Endocytosis is the movement of substances into the cell. Exocytosis is the movement of substances out of the cell. Diffusion is the movement of substances from an area of high concentrain to an area of low concentration.	14846	1	1
6	Diffusion is when the particles pass through the membrane. Osmosis is when water carries the particles in through the membrane. Facilated diffusion is when particles are attatched to something else that is going into the membrane.	14850	1	1
6	1. There is active transport. To where the cell is allowed into the cell or not. The active transport allows only certain type of organisms to enter or leave the cell.2. Diffusion is another way cells get in and out of the cells. Is where the cell, depending on it's size,  will determine whether or not that it is able to move throughout the cell.3. The other one is where the nuclear envolope sends a messeges and tells the membrane what to do from there.	14852	0	0
6	one proses is called cell movement that is where the cell is moved thrue the cell by the organells	14853	0	0
6	Osmosis - water passing through the cell membraneCell Respiration - Cell eating, drinking, and breathing through its membrane.Cannot Remember third GO CELTICS	14870	1	1
6	cells process things coming in and out of the call membrane, calls also	14871	0	0
6	mitochondia moves stuff, lysosomes move things, and chlorophyll moves items.	14872	0	0
6	They guide it.	14883	0	0
6	A cell membrane is whem the cell are attack the membrane for the cell to move thought the membrane. and how it is the number one why for the cell membrane to be attack for the cell to get out.	14884	0	0
6	crossing over, mutations, cellular respiration	14923	0	0
6	plasmembreane to movemovement to move around the cellplacement to place something in the cell	14942	0	0
6	endocytosis- cell membrane envelopes material and is absorbed into the cell.diffusion- concentration gradient is higher outside the cell causing the material to naturally diffuse across the membrane.facilitated diffusion- carrier proteins help materials move with the concentration gradient through the cell membrane.	14948	0	0
6	1. Cells have a permeable membrane.2. Cells are crazy3. Cells do weird things	14953	0	0
6	Diffusion which is a process where substances are transported across the cell membrane.	14958	0	0
6	they grow legs and run away	14967	0	0
6	the ribosomes produce the energy for the cellthe golgi appartatus gets rid of waste and the nucleus hold all the information and DNA	14971	0	0
6	1.They use sodium-potassium pumps to move sodium and potassium in and out.    2.They use vacules to ingulf food through phagocytosis.3. They use markers to deside if the substance is ok to travel into the cell.	14980	1	1
6	THE CELLS TRAVEL TO THE RNA AND SENDS A MESSAGE TO THE MRNA	14982	0	0
6	The cell moves across it by diffusion, respiration, and movement.	14997	0	0
6	cytoplasm keeps things where they are.	14998	0	0
6	The cells use the mebrane as a transportaion and they move lik a boat on water.	15003	0	0
6	Cells use multiple processes to move substances through the membrane. One major type of cellular movement is passive transport. With passive transport, the cell won't have to use any energy to move the substance. The cell can use diffusion, or osmosis if the cell is moving water. The cell can also use active transport to move substances. It can use endocytosis, to bring substances into the cell, or exocytosis to push substances out.	15015	2	2
6	The first process used by cells to cross the membrane would be known as diffusion. Diffusion uses no energy when particles are moving from a concentration of high to low. If they are moving from a concentration of low to high then this does use energy. Diffusion continues until the membrane has obtained equillibrium on both sides.      The second process of cells moving across the membrane is known as osmosis. This is the same as diffusion only water molecules are attempting to cross the membrane. This type of diffusion is known as passive transport and requires no energy. Water needs to be moved in and out of the cell by osmosis to maintain homeostasis.     Facilitated Diffusion is the third process by which substances move across the membrane. This is done by a membrane protein and requires signal molecules to signal the protein to open and close. Once the substance has entered the membrane protein, the protein closes on the outside of the membrane and opens on the inside of the membrane, letting the substance in.	15049	3	3
6	Endocytosis. Endocytosis is when the cell uses a vesical to transport large substances into the cell. Exocytosis. Exocytosis is when the cell uses a vesical to tranport large out of a cell.Ion channels. Ion channels only let certain molecules into the cell.	15055	2	2
6	Three processes used by cells to control movement of substances are growth, synthesis and growth 2.	15061	0	0
6	osmosisexocytosis is where they take large objects out of a cell with vesiclesendocytosis is where the cell takes in objects	15066	0	1
6	The flagellum is used for movement across the cell membrane.Proteins.	15070	0	0
6	diffusion the golgi and the rough endoplasmic reticulum	15086	0	0
6	There is a endoplasmic reticulum that acts like a guide in the cell. Then there is flagella in the cell that helps control the movement. There is also cytoplasm that helps the control.	15090	0	0
6	Potassium pump, diffusion, exocytosis.	15093	0	0
6	The three processed used by cells to control the movement of substances across the cell membrane are; mitosis, meiosis, and cellular respiration.	15094	0	0
6	selective permability	15097	0	0
6	cilli microvilla an villa	15100	0	0
6	Osmosis is the process where water flows in and out of the cell membrane.Active transport uses energy to move molecules throught he membrane of a cell.Passive transport is a process where molecules move through the cell membrane without the use of energy.	15101	3	3
6	the nuclues sends messages to the cell to tell things what to do and what is happening. the ribosomes are little things that helps build energy and theres also the cytoplasm that runs through the cell membrane.	15109	0	0
6	they can move across water. They eat the other fish. The can swim	15132	0	0
6	The substances that move across the cell membrane are DNA, Protiens, and mRNA.	15143	0	0
6	Movement, energy, and Mutation.	15144	0	0
6	They have cytoplasm, which holds all the organelles and substances in the membrane.  They have a cell membrane which keeps organelles and substances inside the cell. The endoplasmic reticulum also moves the substances around.	15157	0	0
6	active transport helps get things through the membrane	15160	0	0
6	One would be reproducton.	15165	0	0
