QuestionId	Answer	AnswerId	Score1	Score2
5	first the mRNA leaves the cell nucleus and moves to the ribosome where tRNA finds complementary bases	10976	1	1
5	The mRNA exits the nucleus and enters the cytoplasm of the cell.Ribisome produce proteins according to the directions on the mRNA.The produced proteins are arranged in the order described by the RNA.They proteins go through the rough endoplasmic reticulum for further modification.	10991	0	0
5	sugarcarbondyoxides	11009	0	0
5	It attaches to tRNA	11022	1	0
5	kingdom	11026	0	0
5	the mRNA leaves the nucleus and travels to the ribosomes.Ribosomes make the poteins needed and sends them off to the mitochondria to send around the cell.	11036	1	1
5	phosphateryboisamino acids	11039	0	0
5	DNA creates AA. which form to make protiens.	11040	0	0
5	The mRNA leaves the nucleus, goes to get coded into amino acids then the amino acids are made into polypeptide chains, then the polypeptide chains are made into proteins.	11054	1	1
5	tRNA transfers information to the DNA, rRNA, gRNA, RNA multiplies	11064	0	0
5	Interphase. Metahase. Anaphaase. Prophase	11066	0	0
5	mRNA go's to the mitochondria annd then turns into tRNA and go' to the nucleus then turns into rRNA then makes the code for protein.	11076	0	0
5	First it is moved from the nucleus. The mRNA is transcribed.  Then it is translated.  Then it is trascoded.	11100	1	1
5	mRNA leaves the nucleus and the eventually develops into tRNA and rRNA . It then absords and develops proteins.	11129	0	0
5	Step 1. mRNA has to be changed into rRNA.Step 2. One of the strands have to leave and another hooks on.Step 3. The strand binds together.Step 4. The strand goes to do its work.	11152	0	0
5	the mRNA leaves the nuclus and then it go's to the tRNA and the tRNA goes and gets the DNA and goes to the ribosome to make protien for the for the RNA.	11160	0	0
5	it goes to the ribosome and gives the instrutions on how to make the dna.	11194	1	1
5	development, compounding, formation, distribution	11200	0	0
5	Starting with the mRNA leaving the nucleus, afterwards, the messenger RNA will then go back to the DNA to give the new strand's copied information. The DNA will then copy the information then re create a new strand for the messenger RNA to take back to the nucleus and bring back a new strand of copied information.	11205	0	0
5	When the mRNA leaves the nucleus it then goes into the cytoplasm where it turns into tRNA. The tRNA then has the codon which codes for the amino acid. From the amino acid it then goes through protein synthesis.	11206	0	0
5	1. The first step is when the mRNA releases from the nucleus into the cytoplasm.2. Next the cytoplasm that has the mRNA in it will attach to a ribosome.3. That ribosome will soon make a peptide bond between the first and second amino acid.4. This will continue until it reaches a stop codon.	11208	2	2
5	mRNA is the messengertRNA transports the RNArRNA relicates the RNAprotien synthesis is the product after the process	11244	0	0
5	Transcription- The mRNA leaves the nucleus, goes into the cytoplasm and finds the ribosomes.Initiation- Part of the mRNA fuses with the ribosomes, telling the ribosomes to begin prtein synthesis.Elongation- The ribosomes forms the proteins. It eventually gets made into peptide chains and during this step the proteins add on to the peptide chain making it grow.Termination- The mRNA tells the ribosome to stop, and the protein synthesis cycle is ended.	11245	1	1
5	It then enters the ribosome in which it meets the tRNA and is then creating an even bigger strain of nucleic acid.	11260	1	1
5	After mRNA leaves the nucleus, the nucleus disappears. This stage is also called Prophase. The next step is when the rRNA takes the ribosomes to the golgi bodies to be 'packages' and send throughout the body to help in certain spots. The third stage is when tRNA is placed together to help make more ribosomes.	11261	0	0
5	tRNA	11263	0	0
5	It copies the mRNA and makes it tRNA which then it copies and makes another identical strand without using the letter T.	11264	0	0
5	The mRNA copies its self exactly then those change themselves with a special codon along with amino acids	11293	0	0
5	Prophase, Metaphase, Anaphase and Telophase are all major steps involved in protein synthesis.	11309	0	0
5	aau,aaa,tau,uuu	11311	0	0
5	The mRNA picks up the copy of the DNA segment that it needs to bring to be transfered.The mRNA takes the DNA segment to the ribosomes.The DNA strand is translated in the by the tRNA.The different protiens represented by the translated DNA strand are made and linked together to form a protien chain.	11337	0	0
5	trna -trainingdrna- begingarna- middleerna- ending	11342	0	0
5	It leaves the nucleus and goes and attacts to cells and then it starts to multiply once it multiplies it involves protein synthesis.	11353	0	0
5	they go to the lips	11356	0	0
5	1) Leaving the nucles the protein has to go through the bloodstream.2) Through the blood stream the protein then goes to the nerves.3) From the nerves it then goes to veins.4) From the veins it then goes to the brain giving the brain the message it needs and the brain sends out everything it needs to send out.	11358	0	0
5	When the mRNA leaves the nucleous, it is taking a copy of the DNA to make more copies and create a protein. As it leaves, it goes into the ribosome where the protein synthesis and copying of the DNA actually happens. In the ribosome, amino acids with the corresponding letters match up to the new copy of the DNA. Stop codons are added to the end and a protein is now made.	11375	1	2
5	mRNA finds tRNA and it decodes the mRNA then tRNA goes to rRNA and makes ribosomes.	11398	1	1
5	The mRNA is the messanger RNA. There are three different types of RNA. MRNA, which is messanger RNA. TRNA which is transfer RNA. And rRNA which creates ribosomes.	11402	0	0
5	First the endoplasmic reticulum takes the protein and breaks it down.  Secondly the ribezomes compress what is left down.  Then the Golgi apparatus takes it to the cell membrane.   The cell membrane then takes it out of the cell.	11423	0	0
5	mRNA leaves the nucleus.it makes a copy of itself.the copy then makes protein.and transcription occurs.	11427	0	0
5	it leaves goes to deliver information.Goes to the rRNA and it reades the information.Then it makes a copy.and that copy goes out and finds matches to go with.	11438	0	0
5	The mRNA leaves the nucleus with the transcribed DNA, which forms RNA, and takes it to the rRNA which is the ribosomal RNA. The rRNA takes it to tRNA to be read. tRNA stands for transfer RNA. tRNA reads and changes the codons to amino acids.	11447	1	1
5	energystores foodprotects the cell and foodhelps it stay alive	11460	0	0
5	mRNA leaves the cell gives it to the tRNA then the tRNA travels and gives it to another cell to be translated and help the body healthy, able to grow, and have the body be able to repair itself.	11462	0	0
5	Diffusion, mitosis, meiosis, and genetic diffusion	11465	0	0
5	The messenger RNA tranfers information in protein synthesis. It also uses the golgi apparatus's information to help it go where it needs to go.	11479	0	0
5	tRNA moves proteins	11492	0	0
5	Ribosomes form proteins.Mitochondria make proteins for energy.Proteins move through the cell membrane to the rest of the organism.	11499	0	0
5	the DNA unzips and the mRNA comes in and then the DNA gets a new code, and if there is a mutism in there then that will happen, then the mRNA will unzip and the tRNA will get the code send it to the ribosome and then it will decode the code that the tRNA gave and send it back to the DNA	11503	0	0
5	The mRNA goes to ribosomes that read it.Ribosomes send a message to tRNA.The tRNA take take a amino acid.Connecting them making a codon.	11504	1	1
5	mRNA leaves the nucleus, and seperates in half. The half of the mRNA gets copied, and is sent to the new nucleus.	11507	0	0
5	the RNA takes the sequence to the ribosomes to make protien	11511	1	1
5	the mRNA is copied and then sent out by the ribosomes. then goes through the endoplasmic reticioulm where it does its job.	11513	1	1
5	1. tRNA2.mRNA3.rRNA4.DNA	11520	0	0
5	After mRNA leaves the nucleus, it travels through the cell into the cytoplasm. Then the codon comes and so do the amino acids. Next the mRNA carries the instructions for the new sequence and codes for new DNA.	11522	0	0
5	1. the mRNA has to travel through the cell to get to were it can exit. 2. The mRNA has to deliever the proteins to were they need to go.	11532	0	0
5	The mRNA goes to the ribosomes which then code for codons, then taken to the amino acids sending it back to the nucleus to recreate new strands of DNA.	11560	1	1
5	It takes the protein over to another organelle. Then the protein gets sent all over the cell. They use it for energy. and then they do it again.	11589	0	0
5	When mRNA leaves the nucleus it transfers to tRNA. Then it makes amino acids. Then the amino acids make a peptide bond, Then the cycle repeats.	11594	1	1
5	First, the mRNA leaves the nucleus. When it enters the cytoplasm, the ribosomes meet up with it and it begins protein synthesis. The tRNA matches up with it, and the amino acids are formed. After the opposite strand is made, they break apart and you have a strand of amino acids.	11616	1	1
5	prophase, anaphase, metaphase, telophase	11622	0	0
5	When mRNA leaves the nucleus it goes and tells the cell what DNA sequences to make. Then tRNA takes the message back to the nucleus. At the nucleus the DNA strand is pulled apart and the new DNA sequences are paired up to their matches to make two new strands of DNA.	11625	0	0
5	transfers to tRNAmakes an amino acid sequencedecodes the amino acid sequencesends it to the	11629	0	0
5	After the mRNA leaves the nucleus it travels through the cytoplasm. Then it travels to the mitochondria where it goes through transcription. Then it detatches from the mitochondria and goes through translation.	11645	0	0
5	mRNA attaches to a DNA strand then the DNA strand unzipsthen it attaches to some proteinsand then creates amino acids.	11647	0	0
5	.gain necessary cell s for the process. spread out and collect the cells .go through the cell cycle . continue through the cycle til process is completed	11651	0	0
5	1.) Mrna leaves 2.) tna	11652	0	0
5	Once the mRNA leaves the nucleus is goes through the blood stream. While in the blood stream once it gets to the other nucleus it drops off the information from the nucleus it just came from. After all that the mRNA is needed no longer. Then comes the tRNA that will help the other nucleus figure out the message. Then it helps the nucleus decode the new message to where it will make sense to the nucleus. Then the rRNA comes along. The rRNA picks up on the new decoded message. Once the rRNA is done getting the message it takes it. The last step would be to take the code and make another RNA sequence.	11656	0	0
5	First, the mRNA leaves the nucleous.Second, the mRNA travels trough the cytoplasm.Third, It arrives at the amino acid sequence of a protein.Finally, it duplicates.	11657	0	0
5	1. unzip2.transfer3.copy/translation4. rezip	11660	0	0
5	mRNA leaves, sends message to tRNA to create more proteins, amino acids get the message, and new proteins are created	11661	0	0
5	The mRNA leaves the nucleus and to the ribosome.  There it gives the message to start protein synthesis.  The protein recieves the messages and the ribosome begins to synthesis it.	11666	1	1
5	mRNA leaves the nucleus to go and be checked for errors. Once the mRNA is in the cytoplasm, protein syntheis follows along the line of nitrogen bases to check for mutation or mistakes. The mistakes are found and labeled to be change, then an enzyme comes to re-do the mistaken nitrogen bases.	11684	0	0
5	it will travel down. it carries the insturction on what to do and how to react	11685	0	0
5	mRNA directs the RNA to make the protiens, then a signal from the nucleus tells it to stop.	11694	0	0
5	1. Proteins leaves the nuclei2. Proteins become stable3.Orgenelles become numerous4.The reproduction rate becomes high	11710	0	0
5	mRNA then codes for pretiens that bind with rRNA	11713	0	0
5	One step involves the golgi apparatus in which it helps carry proteins.Another step uses the ER which helps get rid of unwanted or wasted material involving the proteins.Lysosomes also help break down things that can help with protein synthesis.	11732	0	0
5	mRNA leaves the nucleus carrying instructions for the amino acid sequence to create proteins. First the mRNA will send the instructions to the needed part of the cell, then this will turn into dna. Thirdly proteins would begin to be ensembled in the correct part of the cell and lastly they would be released into the body where they are needed.	11740	0	0
5	It enters. It grows. It breaks down. It leaves.	11750	0	0
5	1) the ribosones collect the mRNA.2) the ribosomes biuld the mRNA into the correct sequence.3) transcription happens.4) the mRNA is pair and attached to the DNA, creating a protein	11779	0	0
5	DNA is copied into a smaller form called messanger RNA or mRNA and then that is copied into tranfer RNA or tRNA to be transfered and replectated once the nucleotide sequences are copied back into mRNA then a new cell has a new set of complete DNA.	11785	0	0
5	1: The mRNA changes into tRNA.2: The tRNA caries proteins to where theyre supposed to go.3: The tRNA changes into proteins, and goes where the other proteins went.4: The body uses those protiens for a variety of things, such as, making new muscle, or healing a cut, or exercise.	11788	0	0
5	TRANSCRIPTION: THE PROCESS OF COPYING THE DNA AND MAKING THE mRNA.THE mRNA IS THEN DELIVERED TO THE RIBOSOMETRANSLATION: THE mRNA IS READ BY tRNATHEN THE CELL PRODUCES PROTIEN BY BUILDING IT	11789	1	1
5	After the mRNA leave the nucleus, tRNA come in and gets a gentic copy of the mRNA. The tRNA detaches from the mRNA. Then takes the information to make a amino acid sequence.	11799	0	0
5	When mRNa leaves the nucleus, there are four major steps involved for protein synthesis. They are prophase, metaphase, anaphase, and telophase. They help with meiosis. Prophase is where the nuclear membrane dissapear and the chromosomes split. Metaphase is where the chromosomes line up. Anaphase is where the chromosomes go off into groups, and telophase is when they gain the nuclear membrane back.	11805	0	0
5	Transportation: DNA becoming mRNA.transcription: mRNA becoming protiens.peptide bonds: Holding the protiens together.deoxirybose: The sugar in the protiens, it helps make the protiens.	11824	0	0
5	The mRNA goes to out of the cell and travels to the others cells and then comes back into the cell to repeat the process.	11828	0	0
5	The mRNA leaves the nucleus through a process called prophase, then the cell gets ready to dived with interphase, ten the cell starts to seperate with interphase, then the cell is finished seperating with metaphase	11831	0	0
5	The mRNA makes a  copy of the DNA strand. the mRNA gives it the tRNA that sends. then the rRNAmakes a protien chain. the protien chain then moves and makes a new cell.	11841	1	0
5	IT BRAKES DOWN INTO SMALLER PARTS AND THEN IS SHIPPED  TO DIFFERENT PARTS OF THE BODY SO IT CAN BE USED AS ENERGY	11862	0	0
5	you have the Mrna that takes to the original rna and makes everything right agian	11877	0	0
5	The first amnio acid comes and attaches to the mRNA then dehydration synthesis occurs. After that the hydrogen bond brakes and that amnio acid goes to find more protien. then that procees continues.	11892	0	0
5	tRNAmRNArRNA	11911	0	0
5	The first step, as already stated, is the mRNA leaving the nucleus to be formed into a protein.  The mRNA then encounters rRNA (the ribosome), which begins reading off the codons on the mRNA to begin forming a protein.  Transfer RNA then comes with anticodons to form amino acids that form together to create the protein.	11925	1	2
5	amino acids help build protein and sugars for atp	11932	0	0
5	mRNA leaves the nucleus then the chromosomes split, move to different sides and create two new cells	11936	0	0
5	Interphase,Metaphase,Anaphase and Telophase.	11948	0	0
5	1. mRNA (messenger RNA) leaves the nucleus with instructions from the nucleus to amino acids for a sequence of a protein.2. tRNA (transfer RNA) transfers the DNA sequence by codons and figures out the genetic code. 3. rRNA (ribosomial RNA) gives the information to a ribosome organelle which now holds all the information.4. the rRNA carries the information back to the nucleus so it can carry out the process and retain the genetic information that it recieved.	11950	0	0
5	The mRNA goes to the ribosome where the tRNA translates the mRNA's codons into peptide chains that then make a polypeptide chain that goes with others to make a protien.	11953	2	2
5	4 major steps involved in protein synthesis is: number 1 the proteins level on top of each other, 2 the strands have to open up, 3 the ball of protein is able to slide through, 4 its on the other side	11960	0	0
5	Starting with mRNA it goes through trna, rrna	11961	0	0
5	Breaking down other protein.  Making new protein. And using the new protein.	11964	0	0
5	Once the mRNA leaves the nucleus, it makes its way through the cell and to the mitocondriton. From there it goes through a cycle and	11965	0	0
5	Four major step are involved whenever the mRNA leaves the nucleus. The first major step is that the mRNA becomes attached to a ribosome. The next step is that the mRNA joins with the tRNA. The third step is that for every three codons the tRNA creat anit-codons. The last step is the making of the amino acids by the tRNA transfering the anti-codons into amino acids, which is needed fpr tje reproduction of DNA.	11971	1	2
5	1. mRNA reaches the ribosome.2. The mRNA is read and is copied.3. The mRNA sequence is copied to tRNA.4. The tRNA is then copied and the copies are used to make more proteins.	11972	1	1
5	After mRNA leaves the nucleus the next step would be for it to deliver the information it is carrying. Then tRNA tranfers the information. The step would be for transcription, translation and transcibing.	11986	0	0
5	Prophase, Anaphase, Telophase, Meiosis	11990	0	0
5	The mRNA enters the ribosome. It then begins translation when the anticodons from the tRNA match up with the codons on the mRNA. The starting codon is always Met. As the tRNA attaches to the mRNA, the amino acids above them form peptide bonds. Finally, the last step is the stop codon on the mRNA. This signals the end of protein synthesis.	11992	3	3
5	The four major steps in making protien synthesis include mRNA leaves the nucleus, the mRNA ,makes prtiens with enzymes, and the protiens are made and used.	12003	0	0
5	1. mRNA seperates from DNA and leaves the nucleus2. The mRNA gives information for making protein3. Codon signals start to make amino acids for proteins4. Sequence hits a stop codon and the protein is released into the cell	12016	1	1
5	1. mRNA heads to the Ribosome2. mRNA gets decoded3. tRNA grabs an amino acid and brings it back to the decoded mRNA4. rRNA  is taken back to the nucleus	12018	2	1
5	tRNAcopies amino acidssends it back to nucleusshares information	12024	0	0
5	The 1st one would be mRNA- which carries instructions from the nucleus to the protein.The 2nd one would be amino acids- which is the sequence of a protein.The 3rd one would be the protein would send a message back to the nucleus.The 4th one would be that mRNA would go through the same process over.	12025	0	0
5	mRNA changes to amino acids the amino acids sends themselves to tRNa	12038	0	0
5	sugars	12044	0	0
5	Go through the cell membrane.Rush to the next cell.Enter the cell.Enter the nucleus to copy the protein and make a gene.	12050	0	0
5	The mRNA meats up with at the Golgi aparatis and then rRNA assembels the other side of the mRNA and once that is done the new strand exits the cell.	12060	0	0
5	After leaving the nucleus, the mRNA has to carefully make it's way to the site of the tRNA. The next step is translation. This step invloves the tRNA to translate the DNA sequence on the mRNA. The third step is the tRNA making it's way to the ribosomes. This step is very important because this step is the step which almost finishes protein synthesis. The last step is when the ribosomes do what the sequence of the DNA says to do.	12095	1	1
5	rRNA then tRNA and DNA	12117	0	0
5	Interphaseanaphaseprophasetelephase	12119	0	0
5	mRNA occurs transfering over to tRNA, while entering the nucleus and dividing into it's own parts of RNA.	12133	0	0
5	mRNA leaves the nucleus.  Next it goes into the golgi aparatus.  Then it starts making amino acids.  After that the ribosomes start making the protein.	12146	0	0
5	mRNA goes to the DNA and makes a copy of the DNA. The mRNA then gives the information to the tRNA which delivers the information to the rRNA. The rRNA then makes the protiens in the ribose of the cell creating new protien.	12158	0	0
5	rRNA decrypts mRNAtRNA gets amino acids to make the protien.	12168	1	1
5	they need to go through the process of mRNA, tRNA ,and dna to finish all the process of the mRNA.	12169	0	0
5	mRNA carries instructions from the nucleus for the amino acid sequence of a protein. tRNA takes instructions to the protein.	12171	0	0
5	The mRNA leave and then sends the material throughout the cell, it contains the proteins and amino acids.  Then it gets sent to tRNA whish transfers the material.  Next rRNA gets the material and recepts it.  Proteins and carbon dioxide is created.	12177	0	0
5	prophaseanaphasemetaphaseinterphase	12183	0	0
5	1 anticodon goup matching a codon group attaches 2 the anticodon takes in the information for its purpose3 the anticodon forms the protein5 the protein is made into a chain	12185	1	1
5	Prophase, metaphase, anaphase, and telophase.	12200	0	0
5	Gathering, distributing, using, and exiting	12203	0	0
5	The mRNA makes another copy of itsself making tRNA.	12227	0	0
5	During protein synthesis the mRNA first leaves the nucleus.  It then goes on to the Golgi Apparatus.  The next step is the Endoplasmic Reticulum (ER).  After the mRNA leaves the ER it makes its way to the nucleus.	12231	1	1
5	The mRNA has to carry the message that protein synthesis should occur. Then the chemicals start going that tell the protein synthesis object to start.Once that starts, it does protein synthesis.Lastly protein synthesis has been done.	12249	0	0
5	The mRNA leaves the nucleus and enters the cytoplasm.  There, it attaches to a ribosome.  Attatched to the ribosome, rRNA comes and brings different codons for amino acids from the mRNA strand to the tRNA strand.  The ribosome moves down the tRNA strand.  The codons attach to the anticodons of the tRNA strand.  As this occurs, ribosomes are forming a strand that codes for the protein.  When the rRNA brings a stop codon, the process ends and the strand containing the protein brakes off to form the actual amino acid for the cell.	12258	2	2
5	1. Prophase- The mRNA is prepared for interphase2. Interphase- The mRNA in torn apart3. Anaphase- The strands are pulled together at the center of the cell4. Telophase- Two new daughter RNA molecules are formed	12268	0	0
5	prophase metaphase anaphase and telephase.	12271	0	0
5	There's translation, and transcription.	12274	0	0
5	mRNA, tRNA,	12275	0	0
5	The mRNA is the taken to be used by tRNA and mRNA. Then it is lined in rows of codons. Then the tRNA and mRNA form together to read and transfer the message for mRNA message. This is all otherwise known as Translation.	12289	1	1
5	1) mRNA leaves nucleus through a nuclear pore2) tRNA comes carrying the complementary codon and amino         acid3) As the tRNA creates amino acids, rRNA moves along the            strand after each amino acid is complete. After a new amino        acid is created, it binds to the previous one, forming a peptide      bond4) When the tRNA encounters a stop codon, the amino acid            chain is complete	12290	2	3
5	1. mRNA leaves the cell2. The ribazome reads each segment    3. As the segments are read amino acids coding for each segment come down to the ribazome4. The amino acids attach to each other to form a protein	12317	1	1
5	The mRNA copies the DNA, then it seperates, and an amino acid goes through. The last step is that it comes back together.	12320	0	0
5	Protein is transferred.Protein is given a more higher level of itself. makes it stronger.Protein then makes its way to the RNA to keep healthy.	12324	0	0
5	The mRNA enters the ribosome.Start codon enters P site, second codon at A site.tRNA adds a amino acid to the codon at the P site and A site.The P site codon breaks apart and the codon at the A site takes its place and the process continues until you hit a stop codon, the chain of amino acids creates a protein.	12329	3	3
5	the mRNA goes to the DNA and uses the tRNA to transfer the genetic code to the DNA so that it could be passed on by sexual reproduction in the sex organs or maybe even just to make more DNA cells	12359	0	0
5	Instuctions come form the nucleas and with amino acids go to build protein with help from the mRNA	12374	0	0
5	the mRNA leaves the nucleus and gets read and then tranlslated itno rRNA and hen it goes back itno the nucleaus	12378	1	1
5	The messenger RNA send the message throught the cell.anaphase interphasprophasemetaphase     Proteins are made up of amino acids that are made up of DNA.	12385	0	0
5	interphase anaphase metaphase telephase	12389	0	0
