QuestionId	Answer	AnswerId	Score1	Score2
6	Three processes that control the movement of substances across the cells membrain are equalibrium, the consentration gradiant and cell division. the consentration gradiant is when the partical move from higher consentration to lower consentration. If the cells consentration gradient is to high it can brust or if it is to small it will shring so it has to be normal.	15185	0	0
6	The cell membrane protects the cell.	15187	0	0
6	They use ribosomes to carry stuff around the cell.The nuclieus is the brain, that helps controll the cell.The cell is small enough to move stuff across it.	15191	0	0
6	floatno movementwalk	15193	0	0
6	Interphase which is the longest phase in the cell.	15200	0	0
6	DNA meosis  , RNA and protein synthesis .	15206	0	0
6	centreles, fluids, and proteins	15207	0	0
6	mitosos, meisosis are two ways that cells control the movement across the cell membrane because they are the cycles where new cells are formed.	15214	0	0
6	Cillia, flagella, and	15215	0	0
6	mitosis moving cells.	15223	0	0
6	1. Free pass or moving freely through the membrane2. Diffusion or the movement of water from high pressure area to low pressure are through the membreane.3. Proteins or the movement of proteins through special small tubes in a cell's membrane.	15245	0	0
6	one is there protein that helps it movetwo is all the cells inside of itthree is all the things inside it	15248	0	0
6	Three processes used by cells to control the movement of subtances across the cell membrane are enzymes can move them.	15256	0	0
6	1. The cell membrane blocks cells from moving around.2. A process called cellular respiration.3. A process called cell diffusion.	15273	0	0
6	Osomises- The balancing of water inside and outside of a cell or necleaus.I don't remember the other two.	15280	0	1
6	1.it controls the blood going through your veins2.it filters the waist products3.it helps the blood count?	15299	0	0
6	Cell membrane controls what enters and leaves the cell. Its like a security guard in the white house. The nucleus reads the information and decides if it should leave or enter the cell. The cell wall protects what enters and leaves the cell also.	15302	0	0
6	One process would be cell growth and metabolism , because to move you need to have the right metabolism so you have the energy to even move in the first place.     A second process could be protein synthesis , because you obviously need all the protein you can get to keep you moving throughout the days of hard work.      A third process is the creation of cells , this is a big part of cell movement. You cant just have one cell and expect it to do everything like move, create energy,etc.	15314	0	0
6	RNA, Vacoules, & proteins.They each move things across the cell.	15324	0	0
6	First the protien comes up to the opening to pass through. Then it uses passive transport, or transport protiens to open the cell membrane and allow the protien to pass through.	15340	0	0
6	1. nucleus- is the boss tells the cell what to do2. Vacuole- cleans everything up3. Mitochondria- produces energy4. mitosis- makes new cells5. Meosis- makes new sex cells	15369	0	0
6	One process is through the use of cyclins. Another way is through the cytoplasm. Lastly is by use of carrier protiens.	15373	0	0
6	reproduction,flagella,nucleus	15375	0	0
6	a cell uses diffusion, osmosis ,and active transport to move substances across th e cell wall	15376	0	0
6	Diffusion- liquid slowly spreads solid through liquid until it's spread out evenly (ex. powdered chocolate in chocolate milk)	15379	0	0
6	The three processes used by cells to control the movement of substances across the cell membrane are DNA movement, respiration, and food gathering.	15381	0	0
6	active transport passive transport osmosis	15409	0	0
6	one way is that they cross thhe cerrebellum to get across.the second way is that it passes through the spine.and idk a third one.	15429	0	0
6	Flagella- helps the cell move. Cilla- which also helps the cell move Slime on the cell wall helps the cell move.	15430	0	0
6	Selective permiability, it only allows certain things to move in and out of the cell.Homeostasis, it regulates the water balance in the cells so the cell can have an isotonic solution.	15433	1	1
6	The cell has certain proteins that match up with certain substances and then lets them into the cell.Diffusion is when the cell lets a higher concentration of water move to a lower concentration of water.Osmosis is when a higher concentration of substances move to a lower concentration of substances.	15437	1	1
6	The cell membrane has a semi premiable membrane that only lets certain things go in and out of the cell.	15442	1	1
6	Three processes used by cells to control the movement of substances across the cell membrane is flagella which helps the cell get throught the membrane, the nucleus that is the control center, and the cell wall to protect the cell from any unwanted cells or anything unwanted.	15443	0	0
6	Three processes used by cells to control the movement of substances across the cell inlcudes: carrying proteins to differents parts of the cell, carrying genetic information, and many other jobs and processes as well.	15455	0	0
6	osmosis,selectively permeable, and diffussion	15458	0	0
6	Interphase, Anaphase, Telophase	15484	0	0
6	MITOCHONDRIA - STORES AND RELEASES ENERGY.NUCLEUS - CONTAINS ALL THE INFORMATION NEEDED FOR THE CELL TO FUNCTIONRESPIRATION - TAKE IN NUTRIENTS AND RELEASES WASTES	15490	0	0
6	transportation is where the cell transports proteins and sugars. transcription is where the cell rads what kind of protein or sugar its dealing with. Transformation is when they transform into bigger cells.	15500	0	0
6	The cell uses osmosis to move water in or out of the cell. It uses diffusion to move other things in and out of the cell and it uses takes things in and out of the cellur membrane because it is semi permeable.	15512	0	1
6	Osmosis	15524	0	0
6	The three processes used by cells to control the movement of substances across the cell membrane are mitosis, meiosis, and photosynthesis.	15525	0	0
6	three processes that cells use to control movement is active transport which uses energy to go against the current, passive transport which requires no energy because is goes with the current, and transport protiens which carry substances through and across the membrane.	15566	2	2
6	The fisrt process is prophase.  The cytoms go to the opposite ends of the cell membrain.  The second form of process is Metaphase.  It Puts all of the chromosomes in the middle and lines them up.  The last process is called Telophase.  It seperates the chromosomes and pulls them to the oposite ends of the cell membrane and seperates the cell into two new cells.	15570	0	0
6	InterphaseTelophaseAnaphase	15572	0	0
6	DIFFUSION,selitve membrane,	15577	0	0
6	1. Active Transport is when a cell in your body work and use engery to  aloow things in and out of your cells. 2. Passive Transport is when your cell do not use engery but allow things in and out of your body such as water. 3.diffusion when	15602	2	2
6	The three processes used by cells to control the movement of substances acrossed the cell membrane are removal of wastes, bringing in of nutriantes, and the cells growth.	15604	0	0
6	Movement, so they can get place to place	15617	0	0
6	defustion lets things in and out of the membrane. Osmois lets water in and out of the membrane.	15631	0	1
6	Three processes used by cells to control the movement of sunbstances across the cell membrane are mRNA, tRNA, and RNA	15634	0	0
6	One way is by osmosis. Osmosis is when cells transport water across the cell membrane. Another way is protien channels. The channels transport big objects across the membrane.	15636	1	1
6	diffusion, exocysitosis, and endocitosis. Exocysotosis moves things out of the cell and endocytosis moves things into the cell. Diffusion moves water into and out of the membrane.	15639	0	0
6	cell membrane cell wall and cytoplasm	15641	0	0
6	Nutrients give off energy. Protein give strength. Movement helps it to move.	15652	0	0
6	three processes used by cells to move substances across the cell mambrane are:1) Active Transport2)3)Difussion	15654	0	0
6	endocytocis, exocytocis, ion channels	15659	0	0
6	Passif of transport.	15662	0	0
6	The cell membrane only allows certain materials intop the cell, by guarding the wall.	15665	0	0
6	One process is active transport, which is transport with the aid of transport proteins. Transport proteins help to get the substances to move through the plasma membrane. Another process is passive transport, which is not very differet from active transport, except this transport does not use the aid of transport proteins. The substances move without them.A third process is exocytosis or endocytosis.Exocytosis is the secreting or expelling of unwanted materials or wastes.Endocytosis is the surrounding and engulfing of materials.	15674	1	1
6	The cell wall processes the movement in and out of the cell.	15678	0	0
6	Cells are the basic unit of all living things. Cells have numerous functions such as fighting off infections when they enter out body. They also transport information all over our body. They let the rest of our bodies know what they're suppose to do. Cells also keep us living and breathing.	15681	0	0
6	they use movement.	15682	0	0
6	Cells carry information to other cells. Cells push out unwanted or unnecessary materials from the body.Cells created other cells.	15683	0	0
6	Passive transport-transport that requires no energy and uses transport protiensfacilitaed diffusion- type of passive transport, movement of particles from high concentration to lower concentrationactive transport- trnasport that requires enery and uses transport protiens	15688	2	2
6	They move the cells.They keep them were the need to be.	15707	0	0
6	They use one process where it just glides across the cell.One process is used to carry it over.And one process is used to slide it across the cell. Transcription Translation and Transversion	15714	0	0
6	PHOTOSYNTHESISFLAGELLUM	15727	0	0
