QuestionId	Answer	AnswerId	Score1	Score2
6	1. Free pass or moving freely through the membrane2. Diffusion or the movement of water from high pressure area to low pressure are through the membreane.3. Proteins or the movement of proteins through special small tubes in a cell's membrane.	15245	0	0
6	DIFFUSION EVENS OUT SUBSTANCES SO THEY REACH EQUILIBRUM, WHICH IS WHEN THEY ARE EVENLY SPREAD THROUGHOUT A SPACE.OSMOSIS IS THE DIFFUSION OF WATER.THE CELL MEMBRANE IS CONSTRUCTED SO THAT CERTIAN SUBSTANCES CAN FIT IN THROUGH IT AND OTHERS CANT.	15246	1	1
6	The cell membrane has 3 processes that it has.1.) It protects the cell 2.) It moves the cell in any way.3.) It can bring food in or out.	15249	0	0
6	Diffusion: If a susbstance has a higher concentration on the outside of the cell, then the cell membrance will diffuse the substance into the cell creating equilibrium. It will do the same thing if the concentration is lower outside the cell only opposite. This is a type of passive transport because the substance is moving with the concentration gradient and it doesn't require any energy.Facilitated Diffusion: If the particles are too large to diffuse across the cell membrane, then protein pumps help. These carry the substances across the membrane without using any energy. This is also a type of passive transport.Osmosis: Osmosis is the process of diffusion only with water. If concentration of a substance is greater outside the cell, then water will move out of the cell to create equilibrium. If the concentration is lower outside the cell, then the cell will move water into the cell to create equilibrium.	15251	3	3
6	acctive transport, diffusion, non-active transport.	15282	0	0
6	Most cells have a cell wall to controll what goes in and out of the cell membrane. Red blood cells carry oxygen around the blood stream. White blood cells fight off diseases.	15283	0	0
6	Transportatin, When protien is giving infomation to other cellinfomation when a cell is told to do somthing.the cell does it.	15289	0	0
6	1.it controls the blood going through your veins2.it filters the waist products3.it helps the blood count?	15299	0	0
6	PASSIVE: passive movement is where an organism or substance can get through the membrane.ACTIVE: active movement is where the thing has to go through the channel protein to enter the cell.Osmosis: water can pass easily through the membrane.	15300	1	1
6	MOVES SLOW BECASE OF THE ENYZYMS	15301	0	0
6	They would have a moving processes.	15304	0	0
6	Three processes used by cells to control the movement of substances across the cell membrane are when the cell membrane uses proteins to allow substances through the membrane, when small particles enter through the cell membrane, and when particles too large to enter the membrane through proteins use enzymes to make the particles smaller.	15317	0	0
6	Facultative diffusion- Particles moving through the protein channels from hig to low concentrationDiffusion- something moving through a cell membrane from high to low concentrationosmosis- water moving through a cell membrane from high concentration to low concentration	15327	3	3
6	The cell membrane is around the the cell, to protech it from every viosas from coming in the cell, also gives the cell food to eat.	15330	0	0
6	anaphase, telophase, prosphase	15361	0	0
6	The cell necluous sends information to the other cells to move the whole organism.	15363	0	0
6	They use passive transport, active transport, and possecive transport.	15374	0	0
6	The three processes used by cells to control the movement of substances across the cell membrane are DNA movement, respiration, and food gathering.	15381	0	0
6	1. Cells have a flagella that helps them move.2. Cells have cilla that help them move.3. Cells are forced to mve.	15396	0	0
6	They all connect to each other.	15411	0	0
6	transporting, reproducing, and protecting. They have to transport food all around the cell and different functions. The cells have to reproduce to make more cells to live. The cell wall protects the inside of the cell so nothing gets out.	15425	0	0
6	Prophase, anaphase, and metaphase	15451	0	0
6	osmosis,selectively permeable, and diffussion	15458	0	0
6	Osmosis, difusion, and phospholipid difusion are three processes by which a substance can move across the cell membrane. Osmosis is the dirusion of a substance through a selectively permeable membrane; usually a substance such as water. difusion is the difusion of other semi-small chemicals or atoms moving across the membrane. Phospholipid difusion is the difusion of larger chemicals or atoms across a membrane with the use of a protien.	15464	0	0
6	The concentration gradient moves things throught the cell pushing them although exocytosis uses its own energy to push things, such as waste, out of the cell.	15485	0	0
6	1) water is carried throughout the cell	15493	0	0
6	Osmosis- controls amount of water in the cell.	15496	0	0
6	Diffusion	15506	0	0
6	The cell membrane regulates what goes in and out of the cell.	15507	0	0
6	Ribosomes can move things across the cell membrane, and the plasma membrane and the cytoskeloton help make it easier for things to move that need to.	15518	0	0
6	passive transport allows things to move freely across the cell membraneactive transport move objects like waste out of the cellcarrier protiens carry nutrients to the cell	15523	0	0
6	#NAME?	15529	0	0
6	difusion,	15531	0	0
6	-Fission;  The incoming substances fuse with the cell membrance and enter the cell.-Lipids;  Substances go through the membrane through hole-like structures.-Packaging;  A substance goes into the membrane, which encases the substance.  Then the package is dumped inside the cell.	15537	0	0
6	Osmosis is the passing of water through the cell membrane. Through osmosis, water can freely pass through the membrane. Diffusion is the passive transport of substances through the cell membrane. In passive transport, substances can freely pass through the membrane without requiring energy from ATP.Active transport is the passing of substances through the cell membrane through transport systems. These require ATP for energy to pass the substances through the membrane.	15544	3	3
6	movement, repridouction, respirtaion	15590	0	0
6	Three processes used by cells to control the movement of substances across the cell membrane could be diffusion, osmosis, and cellular transport. These cells move themselves through the membrane either through or around it.	15591	0	0
6	Cilia- Hair like structures that cover the organism, the friction of the hairs moving allows the organism to moveFlagellum- A long whip like structure is wiggled and the organism moves.	15592	0	0
6	The processes used by cells to control the movement of substance across the cell membrane by meiosis. They let the cell move or the cell would have a flagella.	15609	0	0
6	The cell can use endocystosis, which brings in nutrients and proteins from the outside by wrapping the cell membrane around it. They can also use exocystosis, which puts objects out nutrients and proteins by releasing them in a bubble. There is also the transport protein which allows small nutrients to pass through the membrane.	15612	0	3
6	RECEPTER ROTIENCE ONLY LET SERIAN THING THROUGH, CHANNEL PROTIENCE LET THINGS THROUGH THER CELL WALL. SMALLER THINGS CAN ALOS GO THROUGH THE WALL	15620	0	0
6	diffusion, exocysitosis, and endocitosis. Exocysotosis moves things out of the cell and endocytosis moves things into the cell. Diffusion moves water into and out of the membrane.	15639	0	0
6	cell membrane cell wall and cytoplasm	15641	0	0
6	Diffusion is the process in which something moves from a part of low concentration to Higher Concentration or High to low.Binary fission is the process of moveing something across a permeable membrane.Osmosis is moving water across a semi-permeable membrane.	15642	1	1
6	1. the smooth ER-transfors stuff to the nucles2. the rough ER-takes stuff from yhe nucles3. the golgie-makes ribosomes	15644	0	0
6	three processes used by cells to move substances across the cell mambrane are:1) Active Transport2)3)Difussion	15654	0	0
6	it controls the movement by	15657	0	0
6	THEY MOVE IN LITLE GORPS AND EAT BATREA AND CAN REPORDUCE ASEXUALLY	15670	0	0
6	The cell membrane is a jelly like substance.	15671	0	0
6	Different parts of the cell control the movement of substances across the cell membrane.  The nucleus carries out genetic information such as DNA to the rest of the cell.  The mitochondrian transport energy throughout the cell.  The cytoplasm allows this movement to take place throughout the cell as well.	15680	0	0
6	Cells are the primary block in life and are responsible for for the many complex things that we do . Cells make tissue that make organs that make organ systems .	15695	0	0
6	Tails	15702	0	0
6	mitochondriagolgibodiesnucleus	15733	0	0
6	They use translation, transcription, and replication.	15736	0	0
6	Flagella are used for movement by the cell. Cellular Respiration is a processed used by the cell to breathe. Mitosis is another process used by the cell to reproduce.	15745	0	0
6	Krebs CycleCellular respirationCell Theory	15754	0	0
