QuestionId	Answer	AnswerId	Score1	Score2
5	starting with mrna, it reads the bonds like instructions, then sends this to the nuclesous to get transfered into the second strain. After that it is transfered to the RNA strain, which is turned into the last form. Then is Hocked to the hydroxide bonds.	12464	0	0
5	tRNA    rRNAgRNAmRNA	12475	0	0
5	mRNA leaves nucleus.mRNA is decoded and transported by the tRNAAmino acid is formedProtein is made	12478	1	0
5	When mRNA leaves the nucleus it travels 1st to the mitocondria. Then it goes to the flagellums. After that it goes to be bonded with amino acids and lastly it is changed into protein.	12480	0	0
5	the mRNA transcribes then translates and later forms protiens	12490	0	0
5	During mRNA, it leaves the nucleus and goes into the blood stream. Once it is in the blood stream, it goes through and goes to the mitochondria where the sister cells replicate. After they replicate one set of the genetic information goes back into the blood stream. Then it goes to the brain. This action is completed in just seconds.	12521	0	0
5	endoderm, ectoderm, active transport, and passive tramsport are the 4 steps that are involved in protein synthesis.	12528	0	0
5	There is prophase, metaphase, anaphase, and telephase. Those are four major steps.	12532	0	0
5	The mRNA travels out of the nucleus with genetic information needed to sythesize protien. Next tRNA bonds to the mRNA strand with the anticodons that match up to the mRNA. When the tRNA attaches it creates the amino acids that form a protein strand.	12540	1	1
5	The mRNA goes into the ribosome. Then protiens start to form. tRNA brings in the protiens. Finally, the protiens all join together and form a amino acid chain.	12543	1	1
5	Messenger RNA is transcribed during transcription. Then it is coded to the transfer RNA. Then it is made into proteins. Then the process starts again.	12549	0	0
5	It leaves the RNA strand and then moves to the cell... I really don't remember...	12551	0	0
5	Protien synthesis has four major steps, mRNA, moves the protein, tRNA allows for the protein th tanscribe, rRNA creates the DNA in the RNA, gRNA moves it into the cell	12575	0	0
5	mRNA leave the nucleusIt comes back with a specific amino acidThen it pairs up with a tRNA in the nucleusMore mRNA pair up with other tRNA The amino acid are joined together by a peptide bondThe tRNA discinnectsThe amino acids leave the nucleus to do its job	12584	1	1
5	1. CHEAKING IT2. MAKEING SHURE IT RIGHT3. 4.	12586	0	0
5	ProephaseMetiphaseAntiphaseTeliphase	12591	0	0
5	energy gives it a boost	12594	0	0
5	It is the mRNA and it is the huge major steps and they need to go and have a lot of the synthesis.	12597	0	0
5	First, the mRNA takes the genetic code to the tRNA.  Then the mRNA attaches itself to the tRNA.  Next, the mRNA inscribes the code into the tRNA.  Finally, the mRNA releases itself and goes back to recieve more of the code.	12600	1	1
5	transperation: when the mRna leaves the nucleusRestoration: When the mRna enter the mitocondria	12617	0	0
5	1) The mRNA moves out of the nucleus2) mRNA then goes to the autosome3)	12624	0	0
5	anaphase, metaphase, prophase, and telaphase	12627	0	0
5	The protein will leave the nucleus and go out into the cell. The protein is given a specific job to do after it leaves the nucleus. The protein does this job after it leaves the nucleus. Next the protein will code for different things. Then the protein will help the cell function right.	12634	0	0
5	The mRNA starts off at the nucleus.The mRNA Delivers the message about the proteins.	12644	0	0
5	After mRNA leaves the nucleus, tRNA transfers the proteins to the ER. After this rRNA takes it from the ribosome and then the protein is sent it off into the cell.	12653	0	0
5	mRNA leaves the nucleaus.the mRna goes and tries to find a new amino acid.They carry the amino acid to the RNa strand.Then it creates a a starnd of different RNS's.	12677	0	0
5	1.mRNA  leaving the Nulceus 2.DNA coming inside3.compound bonds get together4.bonds are in one and kill diseases 5.chemical bonds are formed	12691	0	0
5	The mRNA travels to the mitochondria.The mRNA lines up.The mRNA is matched with the anti-codon.	12693	1	1
5	mRNA goes through the golgi apparadus then through the endoplasmic reticulum then into out the cell membrane	12716	1	1
5	ProphaseMetaphaseAnaphaseTelophase	12722	0	0
5	preparedsynthesizingsythensizedenergy usage	12728	0	0
5	blood flows and thats all i know	12730	0	0
5	transcription, translation	12744	0	0
5	The cells getting Rna to make it.The building protein.The copying of the blueprints out of the Dna to make portein.	12746	0	0
5	mRNA is messenger RNA.	12748	0	0
5	1. The mRNA reaches the tRNA.2. tRNA gives the DNA intructions.3. DNA uses the intructions to build genteic code4. Protiens and enzymes are made	12751	0	0
6	1.The structure og the cell's is the same2.living cell's come from another living cell3. cell's come from cell's	13964	0	0
6	First they decide if the substances is good or bad. They insepct the substances by telling if its a protein or a diease.  Secound they elimanate the bad substances. If the substance is good they let it go throw. Third  they ship or store some of the protiens	13968	0	0
6	cell respiration	13979	0	0
6	Three processes used by cells to control the movement of substances across the cell membrane include: Keeping all the healthy cells healthy, getting rid of the bad cells, and maintaining a smooth environment.	13982	0	0
6	cillia- these are short hair like projections that cover the outside of the cell.cell membrain- a barier that lets protiens and food in and out of the cells baodycell wall- also a baier but on plants it helps take in light and releses excces water.	13989	0	0
6	homeostasis	13993	0	0
6	Cells have protective layers that could prevent harmful substances from entering throug the cell membrane.	14005	0	0
6	The golgi aperatis acts as the bodies UPS man to transport material.Flagela is used by certain organisms to move.	14029	0	0
6	One process used by cells to control the movement of substances is when the membrane has different ways of letting different molecules enter.	14030	0	0
6	Osmosis is one process that moves water from a high concentration area, to a lower concentration area. This makes it even throughout the whole cell. Diffusion is another process that moves water from a low area of concentration to a high area of concentration. Activation is another process, it	14042	1	1
6	They can control them, they can redirect them, and they can get rid of them.	14044	0	0
6	Some cells use diffusion, in which matter moves from an aea of higher concentraion to  an area of lower concentration. Cells also use osmosis, where water moves froman area of lower concentration to an rea of high concentration. Thirdly, the use active transport in which the cell uses it's own energy to move nurients through its membrane.	14062	2	3
6	Diffusion is the movement of water over cells. Meiosis is the process in which a substance moves over cell membrane for a short period of time. Mitosis is the process in which water or another substance is moved over a membrane for a long period of  time.	14085	0	0
6	they are passed through various organelles.	14097	0	0
6	1. they start from one part of the body and move too the given area they need2. mRNA3. tRNA	14108	0	0
6	To control the movement of substances across the cell membrane flagellum, cilium, and carrier proteins are used. Flagellum are long, whip-like structures used for movement. Cilium are short, hair-like structures. Carrier proteins are also often used.	14120	0	0
6	they can put stuff in the flow of the blood streem for easier movment.they can fight off bad substances to make the movment more smooth.they can use some substances to make scabs if nessecary.	14128	0	0
6	1. mitosis2. meiosis3. reproduction	14146	0	0
6	the selective permeibility of the cell lets some things in and out but not others	14157	1	1
6	They use the cell membrane to transport certain types of things into and outside the cell. They can use the cytoplasm inside to halp also move things. They use proteins to transport thing around the cell.	14191	0	0
6	OsmosisExocytosisDiffusion	14205	0	0
6	1the flagellum2.	14209	0	0
6	Osmosis is the movement of water across the cell membrane. Diffusion is another type of movement process used by the cell. Neither of these require energy for the cell to use. Active transport, on the other hand, is a process of movement which does require energy.	14219	2	2
6	the cell membrane controls them by having openings only certain substances can go in, by making a substance that wont allow them to come in and by letting some in	14231	0	0
6	1. the cells allows what goes into the membrane.2. the cells allow what goes out of the membrane.3. it controls how the membrane allows the cell to reproduce.	14242	0	0
6	They have the same cells so they can move from place to place.	14249	0	0
6	osmosis - the diffusion of water through celldiffusion - allowing materials through the membrane	14254	1	1
6	tRNA, mRNA,rRNA	14289	0	0
6	Osmosis is used to move water across the cell membrane.______ moves large particles across the cell membrane.______ moves small particles across the cell membrane.	14291	1	1
6	injection	14293	0	0
6	They use mRNA to carry messages to the mitochondria and the cell somehow use that message or energy.	14297	0	0
6	mRNA carries messages from the nucleus to other organstRNA transports dna to places with in the cellrRNA	14300	0	0
6	Osmosis, RNA, and Cell reproduction	14310	0	0
6	The cell membrane uses everything in the cell to control what moves threw out the cell.	14320	0	0
6	1.IT CONTROLS THE MOVMENT OF YOUR BODY MOVMENT.2.IT HELPS YOU THINK.3.IT HELS THE CELL MEMBRANE UNDERSTAND.	14321	0	0
6	The first process is flagella is a tail like structure used for movement.The second process is called cilia it is little hairs that help move cells.The third process is called transfer RNA. It moves around the cell getting information where it needs to go.	14324	0	0
6	the flagellim is used to cause the organism to move about .	14337	0	0
6	Transfer	14342	0	0
6	ProphaseMetaphaseAnaphase	14351	0	0
6	Removes waist, takes in martierials, and	14375	0	0
6	Osmosis- the ovement of waterDiffusion- the movement in a membraneActive Transport- the movement of energy	14389	1	1
6	Active and passive transport moves substances across the membrane.	14390	0	0
6	flagella- it is used to move the cell and how fast it is moving, large hairlike .cilia- it is used to move the cell slower, small hairlike.some cells use thier bodies to move and they move slow.	14407	0	0
6	Three processes used by cells to control substance movement are:Nucleus- tells the cell what to do.Ribosomes- transports proteins across the cell.Endoplasmic reticulum- carries ribosomes through the cell.	14427	0	0
6	Cells use vesicles, transport chains, and protiens to control the movement of subsatnces across the cell membrane. Vesicles eat and digest unwanted or wasted substances. When the vesicle dies, so does the cell.Transport chains carry many things across the cell. This way, equilibrium is reached, RNA can leave the cell, and many other things can occur to keep the cell going.Protions act as gates for subatances entering and leaving the cell. They open and have the particles attatch to them. They then close and open up on the opposite side. This way, things that should not go into the cell are not let in or out.	14435	0	0
6	Cells use selective permiability to control substance movement. The plasma membrane is semi-permiable. It allows water in and out without trouble. However, it acts like a screen because it blocks substances such as sodium from entering the cell. The plasma membrane uses selective permiability because it controls the amout and when of the allowance of substance entrance. Substances enter the cell through carrier proteins. These proteins are surrounded by polar heads and non-fatty acid tails. This membrane is water soluable. The carrier proteins use active and passive transport to move substances in and out of the cell. Passive transport allows substances to move with the gradient and active transport uses cell energy to move substances against the gradient.	14439	3	3
6	1. Passive Diffusion: The passing of substances through the cell membrane, taking no energy on the cell's part.2. Facilitated Diffusion: The passing of substances through the cell membrane that requires energy, working against the gradient.3. Osmosis: Diffusion involving water.	14442	3	2
6	Three processes used by cells to control the movement of substances across the cell membrane are diffusion, osmosis, and endocytosis. Diffusion is the movement of molecules across the cell membrane from an area of high concentration to an area of low concentration. The goal of diffusion is to maintain an equilibrium, and have everything balanced. Osmosis is the diffusion of water across a selectively permeable membrane. Both osmosis and diffusion are forms of passive transport. Passive transport requires no energy from the cell to move substances across its membrane. However, endocytosis is a form of active transport. Endocytosis is the process of moving larger molecules, such a food into the cell. This takes more energy from the cell, and may use enzymes to quicken the process.	14444	3	2
6	Difisuionossmossis	14449	0	0
6	osmosis-uses water to move substances from high to lowdiifusion-	14457	0	0
6	1) nuclear pores move things in and out of the nuclues2) the cell membrane allows substances to m ove in and out of the cell while protecting it from some substances3) Cytoplasm holds everythiing in place in a cell	14460	0	0
6	The three processes are diffusion, cell movement, and also cell mutation.	14468	0	0
6	OSMOIS DIFFUSIONDIFFISION	14471	0	0
6	The cell membrane has three processes to control the movement of substances, one being that it protects the cell, allowing only what it wants to enter and exit.	14498	0	0
6	PHOTOSENTHISIS,	14515	0	0
6	Mitochondria, Golgi Body, Mitosis	14524	0	0
6	how much water gets in the cell.it let's oxygen in	14530	0	0
6	cells change prokaryotesprotects nucleuscirculates other cells	14543	0	0
6	Three processes used by cells to control the movement of substances across the cell membrane is type of phase their on, the protein that tells when to replicate.	14544	0	0
6	1.Diffusion- when cells go from a more concentrated area to a less concentrated area.2. Facilitated Diffusion- when molecules can't move through the lipid bilayer and move through the protein channel instead3. Osmosis- the diffusion of water through a selectively permeable membrane	14561	3	3
6	The nuclius is the brain of the cell that controls everything.  The vacuol takes all unessisary wast and bacteria out of the cell. The mitocondrian surve to maximize cellular reperation by increasing cellular communication.	14562	0	0
6	metosis interphase and prophase	14563	0	0
6	Passive transport allows water to enter without much energy being used from the cell. Active transport is the use of energy to move a protien across the cell membrain. Carrier protiens use a certin type of chemical make up to control what goes into a cell. A Transport protien allows molcules of a certin size to pass through the membrain.	14564	2	3
6	Osmosis is when water on each side of the membrane reaches an equalibrium.Diffusion is when any substance reaches an equilibrium across a semipermiable membrane.Facilitated diffusion is when the substance is moved from the low concentration side of  the membrane to the highly concentrated side of the membrane.	14565	0	0
6	Firstly, there are only so many entrances through the cell membrane that food or other things can enter through. Secondly, if the cell get to much food or other things inside of it, it will close these holes. Thirdly, there are organisms inside and outside the cell that control the flow of food	14582	0	0
6	respirationreproductiondnarna	14585	0	0
6	Three processes used by cells to control the movement are the cell membrane, the cell wall, and the cell nucleous.	14591	0	0
6	The cell membrane determines what go into the cell and what leaves the cell.	14604	0	0
6	One process used by cells to control the movement of a substance is that the nucleous. An other way the cell controls movement is when the ribosomes carry information from one  thing in a cell to another. Lastly is when the RNA and DNA make up sequences telling what should happen in  the movement of the cell.	14634	0	0
6	The cell membrane lets things in.Protein picks up the sustance and moves it around.The substance floats in the cellmembrane.	14638	0	0
6	Cell wall blocks particles.Cell membrance controls the what goes in and what comes out.Cytoplasm helps decide.	14640	0	0
6	Diffusion, selective permiabilty, and osmosis	14648	0	0
6	OsmosisMitosisMeosis	14654	0	0
6	RNAMRNADNA	14661	0	0
6	The cell has a permeated membrane that allows certain things in and keeps certain things out. This also allows the cell to get rid of waste.	14665	1	0
6	Three processes the cell does is hypertension and hypotension.	14677	0	0
6	1. Selective Permiability - The cell lets in certain substances through the cell membrane.	14685	1	1
6	One is the ability to reproduce so quickly.     Two the rate at which and finaly they are very hard to extinct.	14691	0	0
6	Active Transport-This is the transport of something when energy is neededPassive Transport-This is the transport of something without using energyDiffusion-This is the natural movement of a higher concntration to a lower concentration.	14710	3	3
6	mitochdiran- store foodMembrane- help against bad stuff	14711	0	0
6	blood vescles send blood through the body. The immune system uses white blood cells to block off bacteria.	14720	0	0
6	Three processes used by cells to control the movement of substances are;1.Lipids2.Mitochondria	14723	0	0
6	Cells have a fagellum, a tail like structure to help them move, and cillia, hair like structures.	14725	0	0
6	photosynthesis  to absorb light form the sun. goes through a step and then produces	14738	0	0
6	Diffusion is the movement of low concentration to high concentration in the cell membrane. Osmosis is the movement of water going from a low concentration to a high concentration in the cell membrane.	14745	0	0
6	The cell moves its way to the cell membrane by fighting off the fungus.  Then it goes through the stages. Then gets to the cell membrane.	14746	0	0
6	One proccess used by cells is diffusion were the food is slowly allowed to pass through the membrane. Another proccess is when a food particle is surrounded until it is taken into the cell.	14750	0	0
6	It uses small hair like structures to move around. They move back and forth across the membrane to move. then the substance can be moved any where on the cell.	14757	0	0
6	First there is the cell wall in plant cells that block unwanted things from entering the cell. They are there to protect the cell from getting bad things in it like a virus or bacterium or just usless things.  in the cell membrane there is a hole for things like RNA to pass through things still need to enter the cell for the cell to do its job( whatever that may be).	14760	0	0
6	The cell wall keeps everything inside the cell. The vacuole takes out any unhealthy stuff. The mitochondria keeps everything moving and aligned.	14767	0	0
6	passive transport- doesnt require energyactive transport-requires energy	14770	2	2
6	FLAGELLA	14779	0	0
6	transportaion, translation, diffision, transportaion-the way they get around translation- the way they moved thorugh the membrain	14780	0	0
6	cellular respiration which helps the movement digestive system, how the organism gets food and how it reproduces	14782	0	0
6	osmosis	14804	0	0
6	Mitosis, Osmosis, Sexual reproduction	14805	0	0
6	One type of movement acrossed the membrane is osmosis. Osmosis is when the substance uses water to move across the membrane. Another processes is active transport. Active transport is the processes of moving acrossed the membrane by the membrane being selectivly permeable. The last processes is difussion. Diffusion is when the cells  diffuse so that they can move across the selectivly permeable membrane.	14806	0	0
6	The ribosomes decide what enters and leaves the cell. The nucleus lets the waste exit the cell membrane. And, the mitochondria decides at times what can enter.	14810	0	0
6	substances move across the cell mebrane and the cell membrane sometimes lets substances in, ussually food and water, and nutrients	14815	0	0
6	1. dna replication2. 3. protien synthesis	14818	0	0
6	Judges what it is that is trying to cross. Only allows a certain size of something to pass through. Membrane can tell if it is a bad thing. The membrane doesn't have to let everything in.	14826	0	0
6	Osmosis - the movement of particle from greater areas of concentration into areas of lesser concentrationcell permeability - the cells way of controlling what is allwoed through, and what is notpinocytosis - the movement of of small particles across the plama membrane	14828	0	0
6	copy- copy over genetic informationcrossing over- the cell then cross to the membranedivide- the cell then divdes into 2 sections and replicates	14831	0	0
6	Osmosis, the absorbtion of substances into the cell.Facillitated diffusinMitosis	14834	0	0
6	Cells use three different methods to control movement of foreign substances. One for example would be diffusion. It controls the water that moves in and out of a cell. Another example would have to be that the cell wall uses methods to control what comes in and out. They have many specialized glands/openings that allow specific things to enter and leave the cell.	14857	1	0
6	trna transports the cell to the mrna which absorbs the cell which takes it to the rna which is the transformed into dna.	14858	0	0
6	There are three different types of proteins used to transport  substances across the cell membrane.  These three proteins are transport, receptor, and glycoproteins.  Transport proteins transport things directly through the cell membrane, as long as they fit.  Receptor proteins check to see if the thing attemtping to pass through are good for the body or not, and let them through accordingly.  Glycoproteins only open for certain substances to be passed through the cell membrane.	14865	1	1
6	cells process things coming in and out of the call membrane, calls also	14871	0	0
6	mitochondia moves stuff, lysosomes move things, and chlorophyll moves items.	14872	0	0
6	Osmosis- Water moves through the cell membraneDiffusion- Water diffuses through the membraneAbsorbition	14874	1	1
6	flagellun, cell membrane, cell	14896	0	0
6	Three processes used by cells to control the movement of substances across the cell membrane are: diffusion, osmosis, and active transport.  Diffusion is when substances are moved from areas of a higher concentration to areas of a lower concentration. Osmosis is the movement of water through a selectively permeable membrane.  The water moves from a high concentration to a low concentration.  Active transport is the opposite of diffusion.  In active transport substances move from areas of a low concentration to areas of a high concentration.	14905	3	3
6	translation, transcription, and TRNA.	14932	0	0
6	The cell gets rid of waste.The cell lets some substences inside.The cell makes some substances.	14938	0	0
6	ONE:	14945	0	0
6	The cell membrane will only allow certain things to pass through. The cell membrane is jelly like so if it bumps into another cel there is no damage. The cell membrane doesn't allow carbon into it.	14947	0	0
6	cellular respiration, ion channle, lipid bilayer	14974	0	0
6	First of all, cells have a semi-permeable membrane that allows only what the cell wants to allow in.  Second, cells use the cytoplasm in the cell to move and hold different substances and items that are in the cell.  Last of all, some cells have a cell wall that doesnt allow anything in, except for a few spots where the wall is discontinued.	15018	1	1
6	Cell respiration, cell movement, and cellular activation	15028	0	0
6	Three processes to control the movement are diffusion, osmosis, and facultative diffusion. Osmosis is the spread of water through an area. Diffusion is when water is used in various parts of the organism and stored throughout the body. Facultative diffusion is when the nutrients are stored to be used for later.	15035	1	0
6	Diffusion is where the cell moves things acrost the membrain without using energy. Active trasport is a prosses that requires energy to move things acrost the cell.	15038	1	1
6	cell wall cell membrane nucleus	15048	0	0
6	Endocytosis. Endocytosis is when the cell uses a vesical to transport large substances into the cell. Exocytosis. Exocytosis is when the cell uses a vesical to tranport large out of a cell.Ion channels. Ion channels only let certain molecules into the cell.	15055	2	2
6	The 3 processes used by cells to control movement are osmosis, diffusion and active transport.	15087	0	0
6	the cell membrane controls what the cell does and how it functions.cellulair respiration is a process by which cells carry oxygen to the blood stream.the mitochondria is how the cells get energy.	15088	0	0
6	reproduction digestionneucleus	15130	0	0
6	Cells first recognize what is going to be comming through the membrane by sending a singnal to the nucleus so it then cna decide whethere or not whatever wants to enter can. Then the Golgi bodies transport whatever it is through the cell.	15133	0	0
6	telephase gives the information to the nucleusAnaphaseInterphase	15136	0	0
6	1:passed to a cell2:goes through something3:gets to cell membrane	15140	0	0
6	cell division, cellular respiration, cell wall	15173	0	0
